State Code,District Code,India/States,Division,Group,Class,NIC Name,Main Workers - Total -  Persons,Main Workers - Total - Males,Main Workers - Total - Females,Main Workers - Rural -  Persons,Main Workers - Rural - Males,Main Workers - Rural - Females,Main Workers - Urban -  Persons,Main Workers - Urban - Males,Main Workers - Urban - Females,Marginal Workers - Total -  Persons,Marginal Workers - Total - Males,Marginal Workers - Total - Females,Marginal Workers - Rural -  Persons,Marginal Workers - Rural - Males,Marginal Workers - Rural - Females,Marginal Workers - Urban -  Persons,Marginal Workers - Urban - Males,Marginal Workers - Urban - Females
`10,`218,District - Siwan,`47,`472,`4721,Retail sale of food in specialized stores,310,298,12,212,204,8,98,94,4,101,93,8,83,79,4,18,14,4
`10,`218,District - Siwan,`47,`472,`4722,Retail sale of beverages in specialized stores,1,1,0,1,1,0,0,0,0,1,1,0,1,1,0,0,0,0
`10,`218,District - Siwan,`47,`472,`4723,Retail sale of tobacco products in specialized stores,5,5,0,5,5,0,0,0,0,5,5,0,5,5,0,0,0,0
`10,`218,District - Siwan,`47,`473,`0000,Retail sale of automotive fuel in specialized stores,2,2,0,2,2,0,0,0,0,1,1,0,1,1,0,0,0,0
`10,`218,District - Siwan,`47,`473,`4730,Retail sale of automotive fuel in specialized stores,2,2,0,2,2,0,0,0,0,1,1,0,1,1,0,0,0,0
`10,`218,District - Siwan,`47,`474,`0000,Retail sale of information and communications equipment in specialized,2,2,0,2,2,0,0,0,0,0,0,0,0,0,0,0,0,0
`10,`218,District - Siwan,`47,`474,`4741,"Retail sale of computers, peripheral units, software and",2,2,0,2,2,0,0,0,0,0,0,0,0,0,0,0,0,0
`10,`218,District - Siwan,`47,`475,`0000,Retail sale of other household equipment in specialized stores,28,28,0,20,20,0,8,8,0,15,15,0,13,13,0,2,2,0
`10,`218,District - Siwan,`47,`475,`4751,Retail sale of textiles in specialized stores,14,14,0,8,8,0,6,6,0,5,5,0,5,5,0,0,0,0
`10,`218,District - Siwan,`47,`475,`4752,"Retail sale of hardware, paints and glass in specialized stores",3,3,0,3,3,0,0,0,0,5,5,0,5,5,0,0,0,0
`10,`218,District - Siwan,`47,`475,`4759,"Retail sale of electrical household appliances, furniture, lighting",11,11,0,9,9,0,2,2,0,5,5,0,3,3,0,2,2,0
`10,`218,District - Siwan,`47,`476,`0000,Retail sale of cultural and recreation goods in specialized stores,15,15,0,3,3,0,12,12,0,7,7,0,1,1,0,6,6,0
`10,`218,District - Siwan,`47,`476,`4761,"Retail sale of books, newspapers and stationary in specialized stores",14,14,0,2,2,0,12,12,0,7,7,0,1,1,0,6,6,0
`10,`218,District - Siwan,`47,`476,`4764,Retail sale of games and toys in specialized stores,1,1,0,1,1,0,0,0,0,0,0,0,0,0,0,0,0,0
`10,`218,District - Siwan,`47,`477,`0000,Retail sale of other goods in specialized stores,42,39,3,32,31,1,10,8,2,23,23,0,17,17,0,6,6,0
`10,`218,District - Siwan,`47,`477,`4771,"Retail sale of clothing, footwear and leather articles in specialized",19,19,0,15,15,0,4,4,0,6,6,0,6,6,0,0,0,0
`10,`218,District - Siwan,`47,`477,`4772,"Retail sale of pharmaceutical and medical goods, cosmetic and toilet",13,10,3,9,8,1,4,2,2,12,12,0,6,6,0,6,6,0
`10,`218,District - Siwan,`47,`477,`4773,Other retail sale of new goods in specialized stores,10,10,0,8,8,0,2,2,0,5,5,0,5,5,0,0,0,0
`10,`218,District - Siwan,`47,`478,`0000,Retail sale via stalls and markets,12,12,0,12,12,0,0,0,0,3,3,0,3,3,0,0,0,0
`10,`218,District - Siwan,`47,`478,`4781,"Retail sale via stalls and markets of food, beverages and tobacco",5,5,0,5,5,0,0,0,0,0,0,0,0,0,0,0,0,0
`10,`218,District - Siwan,`47,`478,`4782,"Retail sale via stalls and markets of textiles, clothing and footwear",0,0,0,0,0,0,0,0,0,3,3,0,3,3,0,0,0,0
`10,`218,District - Siwan,`47,`478,`4789,Retail sale via stalls and markets of other goods,7,7,0,7,7,0,0,0,0,0,0,0,0,0,0,0,0,0
`10,`218,District - Siwan,`47,`479,`0000,"Retail trade not in stores, stalls or markets",54,52,2,30,28,2,24,24,0,19,18,1,13,12,1,6,6,0
`10,`218,District - Siwan,`47,`479,`4799,"Other retail sale not in stores, stalls or markets",54,52,2,30,28,2,24,24,0,19,18,1,13,12,1,6,6,0
`10,`218,District - Siwan,`49,`000,`0000,Land transport and transport via pipelines,244,240,4,204,202,2,40,38,2,88,86,2,84,82,2,4,4,0
`10,`218,District - Siwan,`49,`491,`0000,Transport via railways,27,27,0,23,23,0,4,4,0,0,0,0,0,0,0,0,0,0
`10,`218,District - Siwan,`49,`491,`4911,Passenger rail transport,23,23,0,19,19,0,4,4,0,0,0,0,0,0,0,0,0,0
`10,`218,District - Siwan,`49,`491,`4912,Freight rail transport,4,4,0,4,4,0,0,0,0,0,0,0,0,0,0,0,0,0
`10,`218,District - Siwan,`49,`492,`0000,Other land transport,217,213,4,181,179,2,36,34,2,88,86,2,84,82,2,4,4,0
`10,`218,District - Siwan,`49,`492,`4921,Urban or suburban passenger land transport,8,8,0,8,8,0,0,0,0,8,8,0,8,8,0,0,0,0
`10,`218,District - Siwan,`49,`492,`4922,Other passenger land transport,130,128,2,106,106,0,24,22,2,46,46,0,42,42,0,4,4,0
`10,`218,District - Siwan,`49,`492,`4923,Freight transport by road,79,77,2,67,65,2,12,12,0,34,32,2,34,32,2,0,0,0
`10,`218,District - Siwan,`51,`000,`0000,Air transport,2,2,0,2,2,0,0,0,0,0,0,0,0,0,0,0,0,0
`10,`218,District - Siwan,`51,`511,`0000,Passenger air transport,2,2,0,2,2,0,0,0,0,0,0,0,0,0,0,0,0,0
`10,`218,District - Siwan,`51,`511,`5110,Passenger air transport,2,2,0,2,2,0,0,0,0,0,0,0,0,0,0,0,0,0
`10,`218,District - Siwan,`52,`000,`0000,Warehousing and support activities for transportation,7,7,0,5,5,0,2,2,0,0,0,0,0,0,0,0,0,0
`10,`218,District - Siwan,`52,`521,`0000,Warehousing and storage,6,6,0,4,4,0,2,2,0,0,0,0,0,0,0,0,0,0
`10,`218,District - Siwan,`52,`521,`5210,Warehousing and storage,6,6,0,4,4,0,2,2,0,0,0,0,0,0,0,0,0,0
`10,`218,District - Siwan,`52,`522,`0000,Support activities for transportation,1,1,0,1,1,0,0,0,0,0,0,0,0,0,0,0,0,0
`10,`218,District - Siwan,`52,`522,`5221,Service activities incidental to land transportation,1,1,0,1,1,0,0,0,0,0,0,0,0,0,0,0,0,0
`10,`218,District - Siwan,`53,`000,`0000,Postal and courier activities,18,18,0,16,16,0,2,2,0,0,0,0,0,0,0,0,0,0
`10,`218,District - Siwan,`53,`531,`0000,Postal activities,18,18,0,16,16,0,2,2,0,0,0,0,0,0,0,0,0,0
`10,`218,District - Siwan,`53,`531,`5310,Postal activities,18,18,0,16,16,0,2,2,0,0,0,0,0,0,0,0,0,0
`10,`218,District - Siwan,`55,`000,`0000,Accommodation,16,13,3,14,13,1,2,0,2,3,2,1,3,2,1,0,0,0
`10,`218,District - Siwan,`55,`551,`0000,Short term accommodation activities,15,12,3,13,12,1,2,0,2,3,2,1,3,2,1,0,0,0
`10,`218,District - Siwan,`55,`551,`5510,Short term accommodation activities,15,12,3,13,12,1,2,0,2,3,2,1,3,2,1,0,0,0
`10,`218,District - Siwan,`55,`559,`0000,Other accommodation,1,1,0,1,1,0,0,0,0,0,0,0,0,0,0,0,0,0
`10,`218,District - Siwan,`55,`559,`5590,Other accommodation,1,1,0,1,1,0,0,0,0,0,0,0,0,0,0,0,0,0
`10,`218,District - Siwan,`56,`000,`0000,Food and beverage service activities,90,87,3,66,63,3,24,24,0,34,28,6,34,28,6,0,0,0
`10,`218,District - Siwan,`56,`561,`0000,Restaurants and mobile food service activities,33,31,2,25,23,2,8,8,0,22,17,5,22,17,5,0,0,0
`10,`218,District - Siwan,`56,`561,`5610,Restaurants and mobile food service activities,33,31,2,25,23,2,8,8,0,22,17,5,22,17,5,0,0,0
`10,`218,District - Siwan,`56,`562,`0000,Event catering and other food service activities,2,2,0,2,2,0,0,0,0,2,2,0,2,2,0,0,0,0
`10,`218,District - Siwan,`56,`562,`5621,Event catering,2,2,0,2,2,0,0,0,0,2,2,0,2,2,0,0,0,0
`10,`218,District - Siwan,`56,`563,`0000,Beverage serving activities,55,54,1,39,38,1,16,16,0,10,9,1,10,9,1,0,0,0
`10,`218,District - Siwan,`56,`563,`5630,Beverage serving activities,55,54,1,39,38,1,16,16,0,10,9,1,10,9,1,0,0,0
`10,`218,District - Siwan,`59,`000,`0000,"Motion picture, video and television programme production, sound recording",3,3,0,1,1,0,2,2,0,1,1,0,1,1,0,0,0,0
`10,`218,District - Siwan,`59,`591,`0000,"Motion picture, video and television programme activities",3,3,0,1,1,0,2,2,0,1,1,0,1,1,0,0,0,0
`10,`218,District - Siwan,`59,`591,`5911,"Motion picture, video and television programme production activities",0,0,0,0,0,0,0,0,0,1,1,0,1,1,0,0,0,0
`10,`218,District - Siwan,`59,`591,`5914,Motion picture projection activities,3,3,0,1,1,0,2,2,0,0,0,0,0,0,0,0,0,0
`10,`218,District - Siwan,`61,`000,`0000,Telecommunications,9,9,0,9,9,0,0,0,0,1,1,0,1,1,0,0,0,0
`10,`218,District - Siwan,`61,`611,`0000,Wired telecommunications activities,5,5,0,5,5,0,0,0,0,1,1,0,1,1,0,0,0,0
`10,`218,District - Siwan,`61,`611,`6110,Wired telecommunications activities,5,5,0,5,5,0,0,0,0,1,1,0,1,1,0,0,0,0
`10,`218,District - Siwan,`61,`612,`0000,Wireless telecommunications activities,2,2,0,2,2,0,0,0,0,0,0,0,0,0,0,0,0,0
`10,`218,District - Siwan,`61,`612,`6120,Wireless telecommunications activities,2,2,0,2,2,0,0,0,0,0,0,0,0,0,0,0,0,0
`10,`218,District - Siwan,`61,`619,`0000,Other telecommunications activities,2,2,0,2,2,0,0,0,0,0,0,0,0,0,0,0,0,0
`10,`218,District - Siwan,`61,`619,`6190,Other telecommunications activities,2,2,0,2,2,0,0,0,0,0,0,0,0,0,0,0,0,0
`10,`218,District - Siwan,`64,`000,`0000,"Financial service activities, except insurance and pension funding",18,17,1,14,13,1,4,4,0,1,1,0,1,1,0,0,0,0
`10,`218,District - Siwan,`64,`641,`0000,Monetary intermediation,16,15,1,14,13,1,2,2,0,0,0,0,0,0,0,0,0,0
`10,`218,District - Siwan,`64,`641,`6411,Central banking,1,1,0,1,1,0,0,0,0,0,0,0,0,0,0,0,0,0
`10,`218,District - Siwan,`64,`641,`6419,Other monetary intermediation,15,14,1,13,12,1,2,2,0,0,0,0,0,0,0,0,0,0
`10,`218,District - Siwan,`64,`649,`0000,"Other financial service activities, except insurance and pension funding",2,2,0,0,0,0,2,2,0,1,1,0,1,1,0,0,0,0
`10,`218,District - Siwan,`64,`649,`6491,Financial leasing,2,2,0,0,0,0,2,2,0,0,0,0,0,0,0,0,0,0
`10,`218,District - Siwan,`64,`649,`6499,"Other financial service activities, except insurance and pension funding",0,0,0,0,0,0,0,0,0,1,1,0,1,1,0,0,0,0
`10,`218,District - Siwan,`65,`000,`0000,"Insurance, reinsurance and pension funding, except compulsory social",12,12,0,4,4,0,8,8,0,2,2,0,2,2,0,0,0,0
`10,`218,District - Siwan,`65,`651,`0000,Insurance,12,12,0,4,4,0,8,8,0,2,2,0,2,2,0,0,0,0
`10,`218,District - Siwan,`65,`651,`6511,Life insurance,12,12,0,4,4,0,8,8,0,1,1,0,1,1,0,0,0,0
`10,`218,District - Siwan,`65,`651,`6512,Non-life insurance,0,0,0,0,0,0,0,0,0,1,1,0,1,1,0,0,0,0
`10,`218,District - Siwan,`69,`000,`0000,Legal and accounting activities,4,4,0,4,4,0,0,0,0,1,1,0,1,1,0,0,0,0
`10,`218,District - Siwan,`69,`691,`0000,Legal activities,4,4,0,4,4,0,0,0,0,1,1,0,1,1,0,0,0,0
`10,`218,District - Siwan,`69,`691,`6910,Legal activities,4,4,0,4,4,0,0,0,0,1,1,0,1,1,0,0,0,0
`10,`218,District - Siwan,`74,`000,`0000,"Other professional, scientific and technical activities",4,4,0,4,4,0,0,0,0,3,3,0,3,3,0,0,0,0
`10,`218,District - Siwan,`74,`741,`0000,Specialized design activities,1,1,0,1,1,0,0,0,0,2,2,0,2,2,0,0,0,0
`10,`218,District - Siwan,`74,`741,`7410,Specialized design activities,1,1,0,1,1,0,0,0,0,2,2,0,2,2,0,0,0,0
`10,`218,District - Siwan,`74,`742,`0000,Photographic activities,1,1,0,1,1,0,0,0,0,1,1,0,1,1,0,0,0,0
`10,`218,District - Siwan,`74,`742,`7420,Photographic activities,1,1,0,1,1,0,0,0,0,1,1,0,1,1,0,0,0,0
`10,`218,District - Siwan,`74,`749,`0000,"Other professional, scientific and technical activities n.e.c.",2,2,0,2,2,0,0,0,0,0,0,0,0,0,0,0,0,0
`10,`218,District - Siwan,`74,`749,`7490,"Other professional, scientific and technical activities n.e.c.",2,2,0,2,2,0,0,0,0,0,0,0,0,0,0,0,0,0
`10,`218,District - Siwan,`77,`000,`0000,Rental and leasing activities,8,8,0,4,4,0,4,4,0,6,6,0,6,6,0,0,0,0
`10,`218,District - Siwan,`77,`772,`0000,Renting and leasing of personal and household goods,8,8,0,4,4,0,4,4,0,6,6,0,6,6,0,0,0,0
`10,`218,District - Siwan,`77,`772,`7729,Renting and leasing of other personal and household goods n.e.c.,8,8,0,4,4,0,4,4,0,6,6,0,6,6,0,0,0,0
`10,`218,District - Siwan,`80,`000,`0000,Security and investigation activities,3,3,0,3,3,0,0,0,0,1,1,0,1,1,0,0,0,0
`10,`218,District - Siwan,`80,`801,`0000,Private security activities,3,3,0,3,3,0,0,0,0,1,1,0,1,1,0,0,0,0
`10,`218,District - Siwan,`80,`801,`8010,Private security activities,3,3,0,3,3,0,0,0,0,1,1,0,1,1,0,0,0,0
`10,`218,District - Siwan,`81,`000,`0000,Services to buildings and landscape activities,1,1,0,1,1,0,0,0,0,0,0,0,0,0,0,0,0,0
`10,`218,District - Siwan,`81,`812,`0000,Cleaning activities,1,1,0,1,1,0,0,0,0,0,0,0,0,0,0,0,0,0
`10,`218,District - Siwan,`81,`812,`8129,Other building and industrial cleaning activities,1,1,0,1,1,0,0,0,0,0,0,0,0,0,0,0,0,0
`10,`218,District - Siwan,`82,`000,`0000,"Office administrative, office support and other business support activities",56,56,0,52,52,0,4,4,0,44,40,4,40,36,4,4,4,0
`10,`218,District - Siwan,`82,`821,`0000,Office administrative and support activities,3,3,0,3,3,0,0,0,0,0,0,0,0,0,0,0,0,0
`10,`218,District - Siwan,`82,`821,`8211,Combined office administrative service activities,2,2,0,2,2,0,0,0,0,0,0,0,0,0,0,0,0,0
`10,`218,District - Siwan,`82,`821,`8219,"Photocopying, document preparation and other specialized office",1,1,0,1,1,0,0,0,0,0,0,0,0,0,0,0,0,0
`10,`218,District - Siwan,`82,`822,`0000,Activities of call centres,1,1,0,1,1,0,0,0,0,0,0,0,0,0,0,0,0,0
`10,`218,District - Siwan,`82,`822,`8220,Activities of call centres,1,1,0,1,1,0,0,0,0,0,0,0,0,0,0,0,0,0
`10,`218,District - Siwan,`82,`829,`0000,Business support service activities n.e.c.,52,52,0,48,48,0,4,4,0,44,40,4,40,36,4,4,4,0
`10,`218,District - Siwan,`82,`829,`8299,Other business support service activities n.e.c.,52,52,0,48,48,0,4,4,0,44,40,4,40,36,4,4,4,0
`10,`218,District - Siwan,`84,`000,`0000,Public administration and defence; compulsory social security,141,134,7,127,122,5,14,12,2,8,8,0,8,8,0,0,0,0
`10,`218,District - Siwan,`84,`841,`0000,Administration of the State and the economic and social policy of the,81,75,6,73,69,4,8,6,2,6,6,0,6,6,0,0,0,0
`10,`218,District - Siwan,`84,`841,`8411,General public administration activities,81,75,6,73,69,4,8,6,2,6,6,0,6,6,0,0,0,0
`10,`218,District - Siwan,`84,`842,`0000,Provision of services to the community as a whole,58,57,1,52,51,1,6,6,0,2,2,0,2,2,0,0,0,0
`10,`218,District - Siwan,`84,`842,`8421,Foreign affairs,2,2,0,2,2,0,0,0,0,1,1,0,1,1,0,0,0,0
`10,`218,District - Siwan,`84,`842,`8422,Defence activities,15,15,0,15,15,0,0,0,0,0,0,0,0,0,0,0,0,0
`10,`218,District - Siwan,`84,`842,`8423,Public order and safety activities,41,40,1,35,34,1,6,6,0,1,1,0,1,1,0,0,0,0
`10,`218,District - Siwan,`84,`843,`0000,Compulsory social security activities,2,2,0,2,2,0,0,0,0,0,0,0,0,0,0,0,0,0
`10,`218,District - Siwan,`84,`843,`8430,Compulsory social security activities,2,2,0,2,2,0,0,0,0,0,0,0,0,0,0,0,0,0
`10,`218,District - Siwan,`85,`000,`0000,Education,339,208,131,313,194,119,26,14,12,33,20,13,31,18,13,2,2,0
`10,`218,District - Siwan,`85,`851,`0000,Primary education,187,113,74,171,105,66,16,8,8,11,5,6,11,5,6,0,0,0
`10,`218,District - Siwan,`85,`851,`8510,Primary education,187,113,74,171,105,66,16,8,8,11,5,6,11,5,6,0,0,0
`10,`218,District - Siwan,`85,`852,`0000,Secondary education,126,77,49,120,73,47,6,4,2,14,8,6,12,6,6,2,2,0
`10,`218,District - Siwan,`85,`852,`8521,General secondary education,126,77,49,120,73,47,6,4,2,14,8,6,12,6,6,2,2,0
`10,`218,District - Siwan,`85,`853,`0000,Higher education,4,4,0,2,2,0,2,2,0,0,0,0,0,0,0,0,0,0
`10,`218,District - Siwan,`85,`853,`8530,Higher education,4,4,0,2,2,0,2,2,0,0,0,0,0,0,0,0,0,0
`10,`218,District - Siwan,`85,`854,`0000,Other education,9,7,2,9,7,2,0,0,0,6,6,0,6,6,0,0,0,0
`10,`218,District - Siwan,`85,`854,`8549,Other education n.e.c.,9,7,2,9,7,2,0,0,0,6,6,0,6,6,0,0,0,0
`10,`218,District - Siwan,`85,`855,`0000,Educational support services,13,7,6,11,7,4,2,0,2,2,1,1,2,1,1,0,0,0
`10,`218,District - Siwan,`85,`855,`8550,Educational support services,13,7,6,11,7,4,2,0,2,2,1,1,2,1,1,0,0,0
`10,`218,District - Siwan,`86,`000,`0000,Human health activities,84,26,58,76,20,56,8,6,2,11,7,4,11,7,4,0,0,0
`10,`218,District - Siwan,`86,`861,`0000,Hospital activities,12,8,4,10,6,4,2,2,0,0,0,0,0,0,0,0,0,0
`10,`218,District - Siwan,`86,`861,`8610,Hospital activities,12,8,4,10,6,4,2,2,0,0,0,0,0,0,0,0,0,0
`10,`218,District - Siwan,`86,`862,`0000,Medical and dental practice activities,15,15,0,11,11,0,4,4,0,3,3,0,3,3,0,0,0,0
`10,`218,District - Siwan,`86,`862,`8620,Medical and dental practice activities,15,15,0,11,11,0,4,4,0,3,3,0,3,3,0,0,0,0
`10,`218,District - Siwan,`86,`869,`0000,Other human health activities,57,3,54,55,3,52,2,0,2,8,4,4,8,4,4,0,0,0
`10,`218,District - Siwan,`86,`869,`8690,Other human health activities,57,3,54,55,3,52,2,0,2,8,4,4,8,4,4,0,0,0
`10,`218,District - Siwan,`87,`000,`0000,Residential care activities,4,4,0,4,4,0,0,0,0,1,1,0,1,1,0,0,0,0
`10,`218,District - Siwan,`87,`879,`0000,Other residential care activities n.e.c.,4,4,0,4,4,0,0,0,0,1,1,0,1,1,0,0,0,0
`10,`218,District - Siwan,`87,`879,`8790,Other residential care activities n.e.c.,4,4,0,4,4,0,0,0,0,1,1,0,1,1,0,0,0,0
`10,`218,District - Siwan,`88,`000,`0000,Social work activities without accommodation,1,0,1,1,0,1,0,0,0,0,0,0,0,0,0,0,0,0
`10,`218,District - Siwan,`88,`889,`0000,Other social work activities without accommodation n.e.c.,1,0,1,1,0,1,0,0,0,0,0,0,0,0,0,0,0,0
`10,`218,District - Siwan,`88,`889,`8890,Other social work activities without accommodation n.e.c.,1,0,1,1,0,1,0,0,0,0,0,0,0,0,0,0,0,0
`10,`218,District - Siwan,`90,`000,`0000,"Creative, arts and entertainment activities",12,11,1,12,11,1,0,0,0,13,12,1,11,10,1,2,2,0
`10,`218,District - Siwan,`90,`900,`0000,"Creative, arts and entertainment activities",12,11,1,12,11,1,0,0,0,13,12,1,11,10,1,2,2,0
`10,`218,District - Siwan,`90,`900,`9000,"Dramatic arts, music and other arts activities",12,11,1,12,11,1,0,0,0,13,12,1,11,10,1,2,2,0
`10,`218,District - Siwan,`91,`000,`0000,"Libraries, archives, museums and other cultural activities",2,2,0,0,0,0,2,2,0,0,0,0,0,0,0,0,0,0
`10,`218,District - Siwan,`91,`910,`0000,"Libraries, archives, museums and other cultural activities",2,2,0,0,0,0,2,2,0,0,0,0,0,0,0,0,0,0
`10,`218,District - Siwan,`91,`910,`9101,Library and archives activities,2,2,0,0,0,0,2,2,0,0,0,0,0,0,0,0,0,0
`10,`218,District - Siwan,`93,`000,`0000,Sports activities and amusement and recreation activities,0,0,0,0,0,0,0,0,0,2,1,1,2,1,1,0,0,0
`10,`218,District - Siwan,`93,`932,`0000,Other amusement and recreation activities,0,0,0,0,0,0,0,0,0,2,1,1,2,1,1,0,0,0
`10,`218,District - Siwan,`93,`932,`9329,Other amusement and recreation activities n.e.c.,0,0,0,0,0,0,0,0,0,2,1,1,2,1,1,0,0,0
`10,`218,District - Siwan,`94,`000,`0000,Activities of membership organizations,3,3,0,3,3,0,0,0,0,1,1,0,1,1,0,0,0,0
`10,`218,District - Siwan,`94,`941,`0000,"Activities of business, employers and professional membership",1,1,0,1,1,0,0,0,0,0,0,0,0,0,0,0,0,0
`10,`218,District - Siwan,`94,`941,`9411,Activities of business and employers membership organizations,1,1,0,1,1,0,0,0,0,0,0,0,0,0,0,0,0,0
`10,`218,District - Siwan,`94,`949,`0000,Activities of other membership organizations,2,2,0,2,2,0,0,0,0,1,1,0,1,1,0,0,0,0
`10,`218,District - Siwan,`94,`949,`9492,Activities of political organizations,2,2,0,2,2,0,0,0,0,1,1,0,1,1,0,0,0,0
`10,`218,District - Siwan,`95,`000,`0000,Repair of computers and personal and household goods,24,24,0,22,22,0,2,2,0,9,9,0,9,9,0,0,0,0
`10,`218,District - Siwan,`95,`951,`0000,Repair of computers and communication equipment,1,1,0,1,1,0,0,0,0,0,0,0,0,0,0,0,0,0
`10,`218,District - Siwan,`95,`951,`9511,Repair of computers and peripheral equipment,1,1,0,1,1,0,0,0,0,0,0,0,0,0,0,0,0,0
`10,`218,District - Siwan,`95,`952,`0000,Repair of personal and household goods,23,23,0,21,21,0,2,2,0,9,9,0,9,9,0,0,0,0
`10,`218,District - Siwan,`95,`952,`9521,Repair of consumer electronics,2,2,0,2,2,0,0,0,0,2,2,0,2,2,0,0,0,0
`10,`218,District - Siwan,`95,`952,`9522,Repair of household appliances and home and garden equipment,1,1,0,1,1,0,0,0,0,0,0,0,0,0,0,0,0,0
`10,`218,District - Siwan,`95,`952,`9529,"Repair of personal and household goods, n.e.c.",20,20,0,18,18,0,2,2,0,7,7,0,7,7,0,0,0,0
`10,`218,District - Siwan,`96,`000,`0000,Other personal service activities,59,56,3,45,44,1,14,12,2,72,70,2,62,60,2,10,10,0
`10,`218,District - Siwan,`96,`960,`0000,Other personal service activities,59,56,3,45,44,1,14,12,2,72,70,2,62,60,2,10,10,0
`10,`218,District - Siwan,`96,`960,`9601,Washing and (dry-) cleaning of textile and fur products,3,3,0,3,3,0,0,0,0,1,1,0,1,1,0,0,0,0
`10,`218,District - Siwan,`96,`960,`9602,Hairdressing and other beauty treatment,2,2,0,2,2,0,0,0,0,0,0,0,0,0,0,0,0,0
`10,`218,District - Siwan,`96,`960,`9609,Other personal service activities n.e.c.,54,51,3,40,39,1,14,12,2,71,69,2,61,59,2,10,10,0
`10,`218,District - Siwan,`97,`000,`0000,Activities of households as employers of domestic personnel,3,1,2,1,1,0,2,0,2,2,0,2,2,0,2,0,0,0
`10,`218,District - Siwan,`97,`970,`0000,Activities of households as employers of domestic personnel,3,1,2,1,1,0,2,0,2,2,0,2,2,0,2,0,0,0
`10,`218,District - Siwan,`97,`970,`9700,Activities of households as employers of domestic personnel,3,1,2,1,1,0,2,0,2,2,0,2,2,0,2,0,0,0
`10,`218,District - Siwan,`98,`000,`0000,Undifferentiated goods- and services-producing activities of private,0,0,0,0,0,0,0,0,0,1,1,0,1,1,0,0,0,0
`10,`218,District - Siwan,`98,`982,`0000,Undifferentiated service-producing activities of private households for own,0,0,0,0,0,0,0,0,0,1,1,0,1,1,0,0,0,0
`10,`218,District - Siwan,`98,`982,`9820,Undifferentiated service-producing activities of private households for own,0,0,0,0,0,0,0,0,0,1,1,0,1,1,0,0,0,0
`10,`218,District - Siwan,`99,`000,`0000,Activities of extraterritorial organizations and bodies,550,309,241,478,257,221,72,52,20,996,465,531,964,457,507,32,8,24
`10,`218,District - Siwan,`99,`991,`0000,Blank,270,208,62,228,172,56,42,36,6,658,380,278,648,372,276,10,8,2
`10,`218,District - Siwan,`99,`991,`9910,Blank,270,208,62,228,172,56,42,36,6,658,380,278,648,372,276,10,8,2
`10,`218,District - Siwan,`99,`992,`0000,Incomplete description/ Wrongly Classifed,280,101,179,250,85,165,30,16,14,338,85,253,316,85,231,22,0,22
`10,`218,District - Siwan,`99,`992,`9920,Incomplete description/ Wrongly Classifed,280,101,179,250,85,165,30,16,14,338,85,253,316,85,231,22,0,22
`10,`219,District - Saran,`00,`000,`0000,Total,1394,1216,178,1238,1077,161,156,139,17,1014,731,283,960,695,265,54,36,18
`10,`219,District - Saran,`01,`000,`0000,"Crop and animal production, hunting and related service activities",9,7,2,8,6,2,1,1,0,10,5,5,10,5,5,0,0,0
`10,`219,District - Saran,`01,`012,`0000,Growing of perennial crops,1,1,0,1,1,0,0,0,0,0,0,0,0,0,0,0,0,0
`10,`219,District - Saran,`01,`012,`0128,"Growing of spices, aromatic, drug and pharmaceutical crops",1,1,0,1,1,0,0,0,0,0,0,0,0,0,0,0,0,0
`10,`219,District - Saran,`01,`014,`0000,Animal production,8,6,2,7,5,2,1,1,0,10,5,5,10,5,5,0,0,0
`10,`219,District - Saran,`01,`014,`0141,Raising of cattle and buffaloes,8,6,2,7,5,2,1,1,0,10,5,5,10,5,5,0,0,0
`10,`219,District - Saran,`02,`000,`0000,Forestry and logging,1,0,1,1,0,1,0,0,0,3,3,0,3,3,0,0,0,0
`10,`219,District - Saran,`02,`021,`0000,Silviculture and other forestry activities,1,0,1,1,0,1,0,0,0,0,0,0,0,0,0,0,0,0
`10,`219,District - Saran,`02,`021,`0210,Silviculture and other forestry activities,1,0,1,1,0,1,0,0,0,0,0,0,0,0,0,0,0,0
`10,`219,District - Saran,`02,`023,`0000,Gathering of non-wood forest products,0,0,0,0,0,0,0,0,0,3,3,0,3,3,0,0,0,0
`10,`219,District - Saran,`02,`023,`0230,Gathering of non-wood forest products,0,0,0,0,0,0,0,0,0,3,3,0,3,3,0,0,0,0
`10,`219,District - Saran,`05,`000,`0000,Mining of coal and lignite,1,1,0,1,1,0,0,0,0,0,0,0,0,0,0,0,0,0
`10,`219,District - Saran,`05,`051,`0000,Mining of hard coal,1,1,0,1,1,0,0,0,0,0,0,0,0,0,0,0,0,0
`10,`219,District - Saran,`05,`051,`0510,Mining of hard coal,1,1,0,1,1,0,0,0,0,0,0,0,0,0,0,0,0,0
`10,`219,District - Saran,`08,`000,`0000,Other mining and quarrying,1,1,0,1,1,0,0,0,0,0,0,0,0,0,0,0,0,0
`10,`219,District - Saran,`08,`081,`0000,"Quarrying of stone, sand and clay",1,1,0,1,1,0,0,0,0,0,0,0,0,0,0,0,0,0
`10,`219,District - Saran,`08,`081,`0810,"Quarrying of stone, sand and clay",1,1,0,1,1,0,0,0,0,0,0,0,0,0,0,0,0,0
`10,`219,District - Saran,`10,`000,`0000,Manufacture of food products,92,74,18,89,71,18,3,3,0,61,33,28,58,33,25,3,0,3
`10,`219,District - Saran,`10,`103,`0000,Processing and preserving of fruit and vegetables,0,0,0,0,0,0,0,0,0,3,3,0,3,3,0,0,0,0
`10,`219,District - Saran,`10,`103,`1030,Processing and preserving of fruit and vegetables,0,0,0,0,0,0,0,0,0,3,3,0,3,3,0,0,0,0
`10,`219,District - Saran,`10,`105,`0000,Manufacture of dairy products,2,2,0,2,2,0,0,0,0,4,0,4,4,0,4,0,0,0
`10,`219,District - Saran,`10,`105,`1050,Manufacture of dairy products,2,2,0,2,2,0,0,0,0,4,0,4,4,0,4,0,0,0
`10,`219,District - Saran,`10,`106,`0000,"Manufacture of grain mill products, starches and starch products",12,4,8,12,4,8,0,0,0,6,2,4,6,2,4,0,0,0
`10,`219,District - Saran,`10,`106,`1061,Manufacture of grain mill products,12,4,8,12,4,8,0,0,0,6,2,4,6,2,4,0,0,0
`10,`219,District - Saran,`10,`107,`0000,Manufacture of other food products,78,68,10,75,65,10,3,3,0,48,28,20,45,28,17,3,0,3
`10,`219,District - Saran,`10,`107,`1071,Manufacture of bakery products,2,2,0,1,1,0,1,1,0,0,0,0,0,0,0,0,0,0
`10,`219,District - Saran,`10,`107,`1073,"Manufacture of cocoa, chocolate and sugar confectionery",8,8,0,8,8,0,0,0,0,5,5,0,5,5,0,0,0,0
`10,`219,District - Saran,`10,`107,`1075,Manufacture of prepared meals and dishes,38,38,0,37,37,0,1,1,0,16,14,2,16,14,2,0,0,0
`10,`219,District - Saran,`10,`107,`1079,Manufacture of other food products n.e.c.,30,20,10,29,19,10,1,1,0,27,9,18,24,9,15,3,0,3
`10,`219,District - Saran,`11,`000,`0000,Manufacture of beverages,0,0,0,0,0,0,0,0,0,2,2,0,2,2,0,0,0,0
`10,`219,District - Saran,`11,`110,`0000,Manufacture of beverages,0,0,0,0,0,0,0,0,0,2,2,0,2,2,0,0,0,0
`10,`219,District - Saran,`11,`110,`1103,Manufacture of malt liquors and malt,0,0,0,0,0,0,0,0,0,1,1,0,1,1,0,0,0,0
`10,`219,District - Saran,`11,`110,`1104,Manufacture of soft drinks; production of mineral waters and other,0,0,0,0,0,0,0,0,0,1,1,0,1,1,0,0,0,0
`10,`219,District - Saran,`13,`000,`0000,Manufacture of textiles,14,14,0,13,13,0,1,1,0,23,23,0,23,23,0,0,0,0
`10,`219,District - Saran,`13,`131,`0000,"Spinning, weaving and finishing of textiles",11,11,0,10,10,0,1,1,0,22,22,0,22,22,0,0,0,0
