State Code,District Code,India/States,Division,Group,Class,NIC Name,Main Workers - Total -  Persons,Main Workers - Total - Males,Main Workers - Total - Females,Main Workers - Rural -  Persons,Main Workers - Rural - Males,Main Workers - Rural - Females,Main Workers - Urban -  Persons,Main Workers - Urban - Males,Main Workers - Urban - Females,Marginal Workers - Total -  Persons,Marginal Workers - Total - Males,Marginal Workers - Total - Females,Marginal Workers - Rural -  Persons,Marginal Workers - Rural - Males,Marginal Workers - Rural - Females,Marginal Workers - Urban -  Persons,Marginal Workers - Urban - Males,Marginal Workers - Urban - Females
`12,`255,District - Lower Subansiri,`64,`642,`6420,Activities of holding companies,2,1,1,1,0,1,1,1,0,0,0,0,0,0,0,0,0,0
`12,`255,District - Lower Subansiri,`65,`000,`0000,"Insurance, reinsurance and pension funding, except compulsory social",15,9,6,2,0,2,13,9,4,0,0,0,0,0,0,0,0,0
`12,`255,District - Lower Subansiri,`65,`651,`0000,Insurance,15,9,6,2,0,2,13,9,4,0,0,0,0,0,0,0,0,0
`12,`255,District - Lower Subansiri,`65,`651,`6511,Life insurance,11,5,6,2,0,2,9,5,4,0,0,0,0,0,0,0,0,0
`12,`255,District - Lower Subansiri,`65,`651,`6512,Non-life insurance,4,4,0,0,0,0,4,4,0,0,0,0,0,0,0,0,0,0
`12,`255,District - Lower Subansiri,`66,`000,`0000,Other financial activities,2,1,1,0,0,0,2,1,1,0,0,0,0,0,0,0,0,0
`12,`255,District - Lower Subansiri,`66,`663,`0000,Fund management activities,2,1,1,0,0,0,2,1,1,0,0,0,0,0,0,0,0,0
`12,`255,District - Lower Subansiri,`66,`663,`6630,Fund management activities,2,1,1,0,0,0,2,1,1,0,0,0,0,0,0,0,0,0
`12,`255,District - Lower Subansiri,`68,`000,`0000,Real estate activities,2,2,0,1,1,0,1,1,0,0,0,0,0,0,0,0,0,0
`12,`255,District - Lower Subansiri,`68,`682,`0000,Real estate activities on a fee or contract basis,2,2,0,1,1,0,1,1,0,0,0,0,0,0,0,0,0,0
`12,`255,District - Lower Subansiri,`68,`682,`6820,Real estate activities on a fee or contract basis,2,2,0,1,1,0,1,1,0,0,0,0,0,0,0,0,0,0
`12,`255,District - Lower Subansiri,`69,`000,`0000,Legal and accounting activities,47,41,6,32,27,5,15,14,1,3,3,0,3,3,0,0,0,0
`12,`255,District - Lower Subansiri,`69,`691,`0000,Legal activities,46,40,6,31,26,5,15,14,1,3,3,0,3,3,0,0,0,0
`12,`255,District - Lower Subansiri,`69,`691,`6910,Legal activities,46,40,6,31,26,5,15,14,1,3,3,0,3,3,0,0,0,0
`12,`255,District - Lower Subansiri,`69,`692,`0000,"Accounting, bookkeeping and auditing activities; tax consultancy",1,1,0,1,1,0,0,0,0,0,0,0,0,0,0,0,0,0
`12,`255,District - Lower Subansiri,`69,`692,`6920,"Accounting, bookkeeping and auditing activities; tax consultancy",1,1,0,1,1,0,0,0,0,0,0,0,0,0,0,0,0,0
`12,`255,District - Lower Subansiri,`72,`000,`0000,Scientific research and development,1,1,0,0,0,0,1,1,0,0,0,0,0,0,0,0,0,0
`12,`255,District - Lower Subansiri,`72,`721,`0000,Research and experimental development on natural sciences and,1,1,0,0,0,0,1,1,0,0,0,0,0,0,0,0,0,0
`12,`255,District - Lower Subansiri,`72,`721,`7210,Research and experimental development on natural sciences and,1,1,0,0,0,0,1,1,0,0,0,0,0,0,0,0,0,0
`12,`255,District - Lower Subansiri,`74,`000,`0000,"Other professional, scientific and technical activities",7,5,2,1,0,1,6,5,1,1,1,0,1,1,0,0,0,0
`12,`255,District - Lower Subansiri,`74,`741,`0000,Specialized design activities,2,0,2,1,0,1,1,0,1,0,0,0,0,0,0,0,0,0
`12,`255,District - Lower Subansiri,`74,`741,`7410,Specialized design activities,2,0,2,1,0,1,1,0,1,0,0,0,0,0,0,0,0,0
`12,`255,District - Lower Subansiri,`74,`742,`0000,Photographic activities,5,5,0,0,0,0,5,5,0,1,1,0,1,1,0,0,0,0
`12,`255,District - Lower Subansiri,`74,`742,`7420,Photographic activities,5,5,0,0,0,0,5,5,0,1,1,0,1,1,0,0,0,0
`12,`255,District - Lower Subansiri,`75,`000,`0000,Veterinary activities,78,68,10,53,49,4,25,19,6,1,1,0,1,1,0,0,0,0
`12,`255,District - Lower Subansiri,`75,`750,`0000,Veterinary activities,78,68,10,53,49,4,25,19,6,1,1,0,1,1,0,0,0,0
`12,`255,District - Lower Subansiri,`75,`750,`7500,Veterinary activities,78,68,10,53,49,4,25,19,6,1,1,0,1,1,0,0,0,0
`12,`255,District - Lower Subansiri,`79,`000,`0000,"Travel agency, tour operator and other reservation service activities",2,2,0,1,1,0,1,1,0,0,0,0,0,0,0,0,0,0
`12,`255,District - Lower Subansiri,`79,`791,`0000,Travel agency and tour operator activities,2,2,0,1,1,0,1,1,0,0,0,0,0,0,0,0,0,0
`12,`255,District - Lower Subansiri,`79,`791,`7911,Travel agency activities,2,2,0,1,1,0,1,1,0,0,0,0,0,0,0,0,0,0
`12,`255,District - Lower Subansiri,`80,`000,`0000,Security and investigation activities,6,6,0,5,5,0,1,1,0,0,0,0,0,0,0,0,0,0
`12,`255,District - Lower Subansiri,`80,`801,`0000,Private security activities,6,6,0,5,5,0,1,1,0,0,0,0,0,0,0,0,0,0
`12,`255,District - Lower Subansiri,`80,`801,`8010,Private security activities,6,6,0,5,5,0,1,1,0,0,0,0,0,0,0,0,0,0
`12,`255,District - Lower Subansiri,`81,`000,`0000,Services to buildings and landscape activities,1,1,0,0,0,0,1,1,0,0,0,0,0,0,0,0,0,0
`12,`255,District - Lower Subansiri,`81,`811,`0000,Combined facilities support activities,1,1,0,0,0,0,1,1,0,0,0,0,0,0,0,0,0,0
`12,`255,District - Lower Subansiri,`81,`811,`8110,Combined facilities support activities,1,1,0,0,0,0,1,1,0,0,0,0,0,0,0,0,0,0
`12,`255,District - Lower Subansiri,`82,`000,`0000,"Office administrative, office support and other business support activities",200,161,39,143,116,27,57,45,12,47,34,13,31,23,8,16,11,5
`12,`255,District - Lower Subansiri,`82,`821,`0000,Office administrative and support activities,12,7,5,10,7,3,2,0,2,1,0,1,1,0,1,0,0,0
`12,`255,District - Lower Subansiri,`82,`821,`8211,Combined office administrative service activities,6,4,2,6,4,2,0,0,0,1,0,1,1,0,1,0,0,0
`12,`255,District - Lower Subansiri,`82,`821,`8219,"Photocopying, document preparation and other specialized office",6,3,3,4,3,1,2,0,2,0,0,0,0,0,0,0,0,0
`12,`255,District - Lower Subansiri,`82,`829,`0000,Business support service activities n.e.c.,188,154,34,133,109,24,55,45,10,46,34,12,30,23,7,16,11,5
`12,`255,District - Lower Subansiri,`82,`829,`8299,Other business support service activities n.e.c.,188,154,34,133,109,24,55,45,10,46,34,12,30,23,7,16,11,5
`12,`255,District - Lower Subansiri,`84,`000,`0000,Public administration and defence; compulsory social security,2182,1728,454,1488,1206,282,694,522,172,70,46,24,57,41,16,13,5,8
`12,`255,District - Lower Subansiri,`84,`841,`0000,Administration of the State and the economic and social policy of the,1384,980,404,931,683,248,453,297,156,40,23,17,36,22,14,4,1,3
`12,`255,District - Lower Subansiri,`84,`841,`8411,General public administration activities,1382,979,403,930,682,248,452,297,155,40,23,17,36,22,14,4,1,3
`12,`255,District - Lower Subansiri,`84,`841,`8412,"Regulation of the activities of providing health care, education, cultural",1,1,0,1,1,0,0,0,0,0,0,0,0,0,0,0,0,0
`12,`255,District - Lower Subansiri,`84,`841,`8413,Regulation of and contribution to more efficient operation of,1,0,1,0,0,0,1,0,1,0,0,0,0,0,0,0,0,0
`12,`255,District - Lower Subansiri,`84,`842,`0000,Provision of services to the community as a whole,486,460,26,321,304,17,165,156,9,22,15,7,14,12,2,8,3,5
`12,`255,District - Lower Subansiri,`84,`842,`8422,Defence activities,322,306,16,203,192,11,119,114,5,16,11,5,10,8,2,6,3,3
`12,`255,District - Lower Subansiri,`84,`842,`8423,Public order and safety activities,164,154,10,118,112,6,46,42,4,6,4,2,4,4,0,2,0,2
`12,`255,District - Lower Subansiri,`84,`843,`0000,Compulsory social security activities,312,288,24,236,219,17,76,69,7,8,8,0,7,7,0,1,1,0
`12,`255,District - Lower Subansiri,`84,`843,`8430,Compulsory social security activities,312,288,24,236,219,17,76,69,7,8,8,0,7,7,0,1,1,0
`12,`255,District - Lower Subansiri,`85,`000,`0000,Education,1712,1044,668,1271,822,449,441,222,219,73,37,36,60,34,26,13,3,10
`12,`255,District - Lower Subansiri,`85,`851,`0000,Primary education,799,486,313,598,388,210,201,98,103,26,15,11,23,15,8,3,0,3
`12,`255,District - Lower Subansiri,`85,`851,`8510,Primary education,799,486,313,598,388,210,201,98,103,26,15,11,23,15,8,3,0,3
`12,`255,District - Lower Subansiri,`85,`852,`0000,Secondary education,590,386,204,426,293,133,164,93,71,14,6,8,10,5,5,4,1,3
`12,`255,District - Lower Subansiri,`85,`852,`8521,General secondary education,584,383,201,422,291,131,162,92,70,14,6,8,10,5,5,4,1,3
`12,`255,District - Lower Subansiri,`85,`852,`8522,Technical and vocational secondary education,6,3,3,4,2,2,2,1,1,0,0,0,0,0,0,0,0,0
`12,`255,District - Lower Subansiri,`85,`853,`0000,Higher education,70,39,31,59,34,25,11,5,6,3,3,0,3,3,0,0,0,0
`12,`255,District - Lower Subansiri,`85,`853,`8530,Higher education,70,39,31,59,34,25,11,5,6,3,3,0,3,3,0,0,0,0
`12,`255,District - Lower Subansiri,`85,`854,`0000,Other education,22,9,13,13,4,9,9,5,4,21,8,13,17,7,10,4,1,3
`12,`255,District - Lower Subansiri,`85,`854,`8541,Sports and recreation education,1,1,0,1,1,0,0,0,0,0,0,0,0,0,0,0,0,0
`12,`255,District - Lower Subansiri,`85,`854,`8549,Other education n.e.c.,21,8,13,12,3,9,9,5,4,21,8,13,17,7,10,4,1,3
`12,`255,District - Lower Subansiri,`85,`855,`0000,Educational support services,231,124,107,175,103,72,56,21,35,9,5,4,7,4,3,2,1,1
`12,`255,District - Lower Subansiri,`85,`855,`8550,Educational support services,231,124,107,175,103,72,56,21,35,9,5,4,7,4,3,2,1,1
`12,`255,District - Lower Subansiri,`86,`000,`0000,Human health activities,750,324,426,503,211,292,247,113,134,28,6,22,23,5,18,5,1,4
`12,`255,District - Lower Subansiri,`86,`861,`0000,Hospital activities,358,187,171,212,109,103,146,78,68,10,3,7,9,3,6,1,0,1
`12,`255,District - Lower Subansiri,`86,`861,`8610,Hospital activities,358,187,171,212,109,103,146,78,68,10,3,7,9,3,6,1,0,1
`12,`255,District - Lower Subansiri,`86,`862,`0000,Medical and dental practice activities,46,32,14,41,29,12,5,3,2,0,0,0,0,0,0,0,0,0
`12,`255,District - Lower Subansiri,`86,`862,`8620,Medical and dental practice activities,46,32,14,41,29,12,5,3,2,0,0,0,0,0,0,0,0,0
`12,`255,District - Lower Subansiri,`86,`869,`0000,Other human health activities,346,105,241,250,73,177,96,32,64,18,3,15,14,2,12,4,1,3
`12,`255,District - Lower Subansiri,`86,`869,`8690,Other human health activities,346,105,241,250,73,177,96,32,64,18,3,15,14,2,12,4,1,3
`12,`255,District - Lower Subansiri,`87,`000,`0000,Residential care activities,1,0,1,0,0,0,1,0,1,0,0,0,0,0,0,0,0,0
`12,`255,District - Lower Subansiri,`87,`879,`0000,Other residential care activities n.e.c.,1,0,1,0,0,0,1,0,1,0,0,0,0,0,0,0,0,0
`12,`255,District - Lower Subansiri,`87,`879,`8790,Other residential care activities n.e.c.,1,0,1,0,0,0,1,0,1,0,0,0,0,0,0,0,0,0
`12,`255,District - Lower Subansiri,`88,`000,`0000,Social work activities without accommodation,34,23,11,25,15,10,9,8,1,4,1,3,4,1,3,0,0,0
`12,`255,District - Lower Subansiri,`88,`881,`0000,Social work activities without accommodation for the elderly and disabled,9,7,2,6,4,2,3,3,0,0,0,0,0,0,0,0,0,0
`12,`255,District - Lower Subansiri,`88,`881,`8810,Social work activities without accommodation for the elderly and,9,7,2,6,4,2,3,3,0,0,0,0,0,0,0,0,0,0
`12,`255,District - Lower Subansiri,`88,`889,`0000,Other social work activities without accommodation n.e.c.,25,16,9,19,11,8,6,5,1,4,1,3,4,1,3,0,0,0
`12,`255,District - Lower Subansiri,`88,`889,`8890,Other social work activities without accommodation n.e.c.,25,16,9,19,11,8,6,5,1,4,1,3,4,1,3,0,0,0
`12,`255,District - Lower Subansiri,`90,`000,`0000,"Creative, arts and entertainment activities",8,8,0,2,2,0,6,6,0,2,2,0,0,0,0,2,2,0
`12,`255,District - Lower Subansiri,`90,`900,`0000,"Creative, arts and entertainment activities",8,8,0,2,2,0,6,6,0,2,2,0,0,0,0,2,2,0
`12,`255,District - Lower Subansiri,`90,`900,`9000,"Dramatic arts, music and other arts activities",8,8,0,2,2,0,6,6,0,2,2,0,0,0,0,2,2,0
`12,`255,District - Lower Subansiri,`91,`000,`0000,"Libraries, archives, museums and other cultural activities",13,7,6,6,5,1,7,2,5,0,0,0,0,0,0,0,0,0
`12,`255,District - Lower Subansiri,`91,`910,`0000,"Libraries, archives, museums and other cultural activities",13,7,6,6,5,1,7,2,5,0,0,0,0,0,0,0,0,0
`12,`255,District - Lower Subansiri,`91,`910,`9101,Library and archives activities,10,5,5,5,4,1,5,1,4,0,0,0,0,0,0,0,0,0
`12,`255,District - Lower Subansiri,`91,`910,`9102,Museums activities and operation of historical sites and buildings,2,1,1,0,0,0,2,1,1,0,0,0,0,0,0,0,0,0
`12,`255,District - Lower Subansiri,`91,`910,`9103,Botanical and zoological gardens and nature reserves activities,1,1,0,1,1,0,0,0,0,0,0,0,0,0,0,0,0,0
`12,`255,District - Lower Subansiri,`92,`000,`0000,Gambling and betting activities,3,3,0,2,2,0,1,1,0,1,1,0,1,1,0,0,0,0
`12,`255,District - Lower Subansiri,`92,`920,`0000,Gambling and betting activities,3,3,0,2,2,0,1,1,0,1,1,0,1,1,0,0,0,0
`12,`255,District - Lower Subansiri,`92,`920,`9200,Gambling and betting activities,3,3,0,2,2,0,1,1,0,1,1,0,1,1,0,0,0,0
`12,`255,District - Lower Subansiri,`93,`000,`0000,Sports activities and amusement and recreation activities,5,4,1,4,3,1,1,1,0,0,0,0,0,0,0,0,0,0
`12,`255,District - Lower Subansiri,`93,`931,`0000,Sports activities,5,4,1,4,3,1,1,1,0,0,0,0,0,0,0,0,0,0
`12,`255,District - Lower Subansiri,`93,`931,`9311,Operation of sports facilities,2,2,0,1,1,0,1,1,0,0,0,0,0,0,0,0,0,0
`12,`255,District - Lower Subansiri,`93,`931,`9312,Activities of sports clubs,1,1,0,1,1,0,0,0,0,0,0,0,0,0,0,0,0,0
`12,`255,District - Lower Subansiri,`93,`931,`9319,Other sports activities,2,1,1,2,1,1,0,0,0,0,0,0,0,0,0,0,0,0
`12,`255,District - Lower Subansiri,`94,`000,`0000,Activities of membership organizations,116,95,21,89,70,19,27,25,2,30,26,4,27,25,2,3,1,2
`12,`255,District - Lower Subansiri,`94,`941,`0000,"Activities of business, employers and professional membership",3,2,1,3,2,1,0,0,0,0,0,0,0,0,0,0,0,0
`12,`255,District - Lower Subansiri,`94,`941,`9411,Activities of business and employers membership organizations,3,2,1,3,2,1,0,0,0,0,0,0,0,0,0,0,0,0
`12,`255,District - Lower Subansiri,`94,`949,`0000,Activities of other membership organizations,113,93,20,86,68,18,27,25,2,30,26,4,27,25,2,3,1,2
`12,`255,District - Lower Subansiri,`94,`949,`9491,Activities of religious organizations,17,14,3,10,8,2,7,6,1,5,5,0,4,4,0,1,1,0
`12,`255,District - Lower Subansiri,`94,`949,`9492,Activities of political organizations,95,78,17,76,60,16,19,18,1,25,21,4,23,21,2,2,0,2
`12,`255,District - Lower Subansiri,`94,`949,`9499,Activities of other membership organizations n.e.c.,1,1,0,0,0,0,1,1,0,0,0,0,0,0,0,0,0,0
`12,`255,District - Lower Subansiri,`95,`000,`0000,Repair of computers and personal and household goods,36,34,2,15,14,1,21,20,1,2,2,0,1,1,0,1,1,0
`12,`255,District - Lower Subansiri,`95,`951,`0000,Repair of computers and communication equipment,3,3,0,0,0,0,3,3,0,0,0,0,0,0,0,0,0,0
`12,`255,District - Lower Subansiri,`95,`951,`9511,Repair of computers and peripheral equipment,1,1,0,0,0,0,1,1,0,0,0,0,0,0,0,0,0,0
`12,`255,District - Lower Subansiri,`95,`951,`9512,Repair of communication equipment,2,2,0,0,0,0,2,2,0,0,0,0,0,0,0,0,0,0
`12,`255,District - Lower Subansiri,`95,`952,`0000,Repair of personal and household goods,33,31,2,15,14,1,18,17,1,2,2,0,1,1,0,1,1,0
`12,`255,District - Lower Subansiri,`95,`952,`9521,Repair of consumer electronics,3,3,0,3,3,0,0,0,0,0,0,0,0,0,0,0,0,0
`12,`255,District - Lower Subansiri,`95,`952,`9522,Repair of household appliances and home and garden equipment,2,2,0,1,1,0,1,1,0,1,1,0,1,1,0,0,0,0
`12,`255,District - Lower Subansiri,`95,`952,`9523,Repair of footwear and leather goods,8,8,0,0,0,0,8,8,0,0,0,0,0,0,0,0,0,0
`12,`255,District - Lower Subansiri,`95,`952,`9529,"Repair of personal and household goods, n.e.c.",20,18,2,11,10,1,9,8,1,1,1,0,0,0,0,1,1,0
`12,`255,District - Lower Subansiri,`96,`000,`0000,Other personal service activities,139,111,28,56,36,20,83,75,8,23,16,7,18,12,6,5,4,1
`12,`255,District - Lower Subansiri,`96,`960,`0000,Other personal service activities,139,111,28,56,36,20,83,75,8,23,16,7,18,12,6,5,4,1
`12,`255,District - Lower Subansiri,`96,`960,`9601,Washing and (dry-) cleaning of textile and fur products,10,10,0,1,1,0,9,9,0,1,1,0,1,1,0,0,0,0
`12,`255,District - Lower Subansiri,`96,`960,`9602,Hairdressing and other beauty treatment,53,34,19,30,17,13,23,17,6,10,6,4,8,5,3,2,1,1
`12,`255,District - Lower Subansiri,`96,`960,`9609,Other personal service activities n.e.c.,76,67,9,25,18,7,51,49,2,12,9,3,9,6,3,3,3,0
`12,`255,District - Lower Subansiri,`97,`000,`0000,Activities of households as employers of domestic personnel,127,36,91,72,22,50,55,14,41,57,8,49,52,5,47,5,3,2
`12,`255,District - Lower Subansiri,`97,`970,`0000,Activities of households as employers of domestic personnel,127,36,91,72,22,50,55,14,41,57,8,49,52,5,47,5,3,2
`12,`255,District - Lower Subansiri,`97,`970,`9700,Activities of households as employers of domestic personnel,127,36,91,72,22,50,55,14,41,57,8,49,52,5,47,5,3,2
`12,`255,District - Lower Subansiri,`98,`000,`0000,Undifferentiated goods- and services-producing activities of private,2,1,1,1,0,1,1,1,0,1,0,1,1,0,1,0,0,0
`12,`255,District - Lower Subansiri,`98,`981,`0000,Undifferentiated goods-producing activities of private households for own,2,1,1,1,0,1,1,1,0,0,0,0,0,0,0,0,0,0
`12,`255,District - Lower Subansiri,`98,`981,`9810,Undifferentiated goods-producing activities of private households for own,2,1,1,1,0,1,1,1,0,0,0,0,0,0,0,0,0,0
`12,`255,District - Lower Subansiri,`98,`982,`0000,Undifferentiated service-producing activities of private households for own,0,0,0,0,0,0,0,0,0,1,0,1,1,0,1,0,0,0
`12,`255,District - Lower Subansiri,`98,`982,`9820,Undifferentiated service-producing activities of private households for own,0,0,0,0,0,0,0,0,0,1,0,1,1,0,1,0,0,0
`12,`255,District - Lower Subansiri,`99,`000,`0000,Activities of extraterritorial organizations and bodies,464,224,240,393,200,193,71,24,47,1006,413,593,825,378,447,181,35,146
`12,`255,District - Lower Subansiri,`99,`991,`0000,Blank,275,150,125,226,129,97,49,21,28,554,255,299,448,226,222,106,29,77
`12,`255,District - Lower Subansiri,`99,`991,`9910,Blank,275,150,125,226,129,97,49,21,28,554,255,299,448,226,222,106,29,77
`12,`255,District - Lower Subansiri,`99,`992,`0000,Incomplete description/ Wrongly Classifed,189,74,115,167,71,96,22,3,19,452,158,294,377,152,225,75,6,69
`12,`255,District - Lower Subansiri,`99,`992,`9920,Incomplete description/ Wrongly Classifed,189,74,115,167,71,96,22,3,19,452,158,294,377,152,225,75,6,69
`12,`256,District - Kurung Kumey,`00,`000,`0000,Total,4912,3131,1781,4474,2777,1697,438,354,84,2768,1456,1312,2647,1385,1262,121,71,50
`12,`256,District - Kurung Kumey,`01,`000,`0000,"Crop and animal production, hunting and related service activities",329,145,184,325,142,183,4,3,1,274,123,151,267,119,148,7,4,3
`12,`256,District - Kurung Kumey,`01,`011,`0000,Growing of non-perennial crops,239,98,141,239,98,141,0,0,0,221,92,129,217,90,127,4,2,2
`12,`256,District - Kurung Kumey,`01,`011,`0111,"Growing of cereals (except rice), leguminous crops and oil seeds",7,5,2,7,5,2,0,0,0,3,1,2,3,1,2,0,0,0
`12,`256,District - Kurung Kumey,`01,`011,`0112,Growing of rice,231,92,139,231,92,139,0,0,0,215,89,126,211,87,124,4,2,2
`12,`256,District - Kurung Kumey,`01,`011,`0113,"Growing of vegetables and melons, roots and tubers",1,1,0,1,1,0,0,0,0,2,2,0,2,2,0,0,0,0
`12,`256,District - Kurung Kumey,`01,`011,`0114,Growing of sugar cane,0,0,0,0,0,0,0,0,0,1,0,1,1,0,1,0,0,0
`12,`256,District - Kurung Kumey,`01,`012,`0000,Growing of perennial crops,4,2,2,4,2,2,0,0,0,1,0,1,1,0,1,0,0,0
`12,`256,District - Kurung Kumey,`01,`012,`0122,Growing of tropical and subtropical fruits,1,1,0,1,1,0,0,0,0,0,0,0,0,0,0,0,0,0
`12,`256,District - Kurung Kumey,`01,`012,`0123,Growing of citrus fruits,1,0,1,1,0,1,0,0,0,0,0,0,0,0,0,0,0,0
`12,`256,District - Kurung Kumey,`01,`012,`0126,Growing of oleaginous fruits,1,1,0,1,1,0,0,0,0,0,0,0,0,0,0,0,0,0
`12,`256,District - Kurung Kumey,`01,`012,`0127,Growing of beverage crops,0,0,0,0,0,0,0,0,0,1,0,1,1,0,1,0,0,0
`12,`256,District - Kurung Kumey,`01,`012,`0128,"Growing of spices, aromatic, drug and pharmaceutical crops",1,0,1,1,0,1,0,0,0,0,0,0,0,0,0,0,0,0
`12,`256,District - Kurung Kumey,`01,`013,`0000,Plant propagation,4,4,0,4,4,0,0,0,0,0,0,0,0,0,0,0,0,0
`12,`256,District - Kurung Kumey,`01,`013,`0130,Plant propagation,4,4,0,4,4,0,0,0,0,0,0,0,0,0,0,0,0,0
`12,`256,District - Kurung Kumey,`01,`014,`0000,Animal production,3,0,3,3,0,3,0,0,0,0,0,0,0,0,0,0,0,0
`12,`256,District - Kurung Kumey,`01,`014,`0145,Raising of swine/pigs,1,0,1,1,0,1,0,0,0,0,0,0,0,0,0,0,0,0
`12,`256,District - Kurung Kumey,`01,`014,`0146,Raising of poultry,1,0,1,1,0,1,0,0,0,0,0,0,0,0,0,0,0,0
`12,`256,District - Kurung Kumey,`01,`014,`0149,Raising of other animals,1,0,1,1,0,1,0,0,0,0,0,0,0,0,0,0,0,0
`12,`256,District - Kurung Kumey,`01,`015,`0000,Mixed farming,25,11,14,25,11,14,0,0,0,20,7,13,20,7,13,0,0,0
`12,`256,District - Kurung Kumey,`01,`015,`0150,Mixed farming,25,11,14,25,11,14,0,0,0,20,7,13,20,7,13,0,0,0
`12,`256,District - Kurung Kumey,`01,`016,`0000,Support activities to agriculture and post-harvest crop activities,49,25,24,45,22,23,4,3,1,16,8,8,13,6,7,3,2,1
`12,`256,District - Kurung Kumey,`01,`016,`0161,Support activities for crop production,41,18,23,37,15,22,4,3,1,16,8,8,13,6,7,3,2,1
`12,`256,District - Kurung Kumey,`01,`016,`0163,Post-harvest crop activities,8,7,1,8,7,1,0,0,0,0,0,0,0,0,0,0,0,0
`12,`256,District - Kurung Kumey,`01,`017,`0000,"Hunting, trapping and related service activities",5,5,0,5,5,0,0,0,0,16,16,0,16,16,0,0,0,0
`12,`256,District - Kurung Kumey,`01,`017,`0170,"Hunting, trapping and related service activities",5,5,0,5,5,0,0,0,0,16,16,0,16,16,0,0,0,0
`12,`256,District - Kurung Kumey,`02,`000,`0000,Forestry and logging,96,88,8,88,81,7,8,7,1,13,12,1,13,12,1,0,0,0
`12,`256,District - Kurung Kumey,`02,`021,`0000,Silviculture and other forestry activities,2,1,1,2,1,1,0,0,0,1,1,0,1,1,0,0,0,0
`12,`256,District - Kurung Kumey,`02,`021,`0210,Silviculture and other forestry activities,2,1,1,2,1,1,0,0,0,1,1,0,1,1,0,0,0,0
`12,`256,District - Kurung Kumey,`02,`022,`0000,Logging,52,52,0,52,52,0,0,0,0,9,9,0,9,9,0,0,0,0
`12,`256,District - Kurung Kumey,`02,`022,`0220,Logging,52,52,0,52,52,0,0,0,0,9,9,0,9,9,0,0,0,0
`12,`256,District - Kurung Kumey,`02,`023,`0000,Gathering of non-wood forest products,8,8,0,8,8,0,0,0,0,0,0,0,0,0,0,0,0,0
`12,`256,District - Kurung Kumey,`02,`023,`0230,Gathering of non-wood forest products,8,8,0,8,8,0,0,0,0,0,0,0,0,0,0,0,0,0
`12,`256,District - Kurung Kumey,`02,`024,`0000,Support services to forestry,34,27,7,26,20,6,8,7,1,3,2,1,3,2,1,0,0,0
`12,`256,District - Kurung Kumey,`02,`024,`0240,Support services to forestry,34,27,7,26,20,6,8,7,1,3,2,1,3,2,1,0,0,0
`12,`256,District - Kurung Kumey,`03,`000,`0000,Fishing and aquaculture,11,10,1,11,10,1,0,0,0,11,11,0,11,11,0,0,0,0
`12,`256,District - Kurung Kumey,`03,`031,`0000,Fishing,9,9,0,9,9,0,0,0,0,9,9,0,9,9,0,0,0,0
`12,`256,District - Kurung Kumey,`03,`031,`0311,Marine fishing,7,7,0,7,7,0,0,0,0,1,1,0,1,1,0,0,0,0
`12,`256,District - Kurung Kumey,`03,`031,`0312,Freash water fishing,2,2,0,2,2,0,0,0,0,8,8,0,8,8,0,0,0,0
`12,`256,District - Kurung Kumey,`03,`032,`0000,Aquaculture,2,1,1,2,1,1,0,0,0,2,2,0,2,2,0,0,0,0
`12,`256,District - Kurung Kumey,`03,`032,`0322,Freshwater aquaculture,2,1,1,2,1,1,0,0,0,2,2,0,2,2,0,0,0,0
`12,`256,District - Kurung Kumey,`09,`000,`0000,Mining support service activities,1,1,0,1,1,0,0,0,0,0,0,0,0,0,0,0,0,0
`12,`256,District - Kurung Kumey,`09,`099,`0000,Support activities for other mining and quarrying,1,1,0,1,1,0,0,0,0,0,0,0,0,0,0,0,0,0
`12,`256,District - Kurung Kumey,`09,`099,`0990,Support activities for other mining and quarrying,1,1,0,1,1,0,0,0,0,0,0,0,0,0,0,0,0,0
`12,`256,District - Kurung Kumey,`10,`000,`0000,Manufacture of food products,126,60,66,126,60,66,0,0,0,55,26,29,54,25,29,1,1,0
`12,`256,District - Kurung Kumey,`10,`102,`0000,"Processing and preserving of fish, crustaceans and molluscs",1,1,0,1,1,0,0,0,0,0,0,0,0,0,0,0,0,0
`12,`256,District - Kurung Kumey,`10,`102,`1020,"Processing and preserving of fish, crustaceans and molluscs and",1,1,0,1,1,0,0,0,0,0,0,0,0,0,0,0,0,0
`12,`256,District - Kurung Kumey,`10,`103,`0000,Processing and preserving of fruit and vegetables,13,6,7,13,6,7,0,0,0,8,5,3,7,4,3,1,1,0
`12,`256,District - Kurung Kumey,`10,`103,`1030,Processing and preserving of fruit and vegetables,13,6,7,13,6,7,0,0,0,8,5,3,7,4,3,1,1,0
`12,`256,District - Kurung Kumey,`10,`105,`0000,Manufacture of dairy products,4,0,4,4,0,4,0,0,0,6,1,5,6,1,5,0,0,0
`12,`256,District - Kurung Kumey,`10,`105,`1050,Manufacture of dairy products,4,0,4,4,0,4,0,0,0,6,1,5,6,1,5,0,0,0
`12,`256,District - Kurung Kumey,`10,`106,`0000,"Manufacture of grain mill products, starches and starch products",72,29,43,72,29,43,0,0,0,26,15,11,26,15,11,0,0,0
`12,`256,District - Kurung Kumey,`10,`106,`1061,Manufacture of grain mill products,71,29,42,71,29,42,0,0,0,24,14,10,24,14,10,0,0,0
`12,`256,District - Kurung Kumey,`10,`106,`1062,Manufacture of starches and starch products,1,0,1,1,0,1,0,0,0,2,1,1,2,1,1,0,0,0
`12,`256,District - Kurung Kumey,`10,`107,`0000,Manufacture of other food products,36,24,12,36,24,12,0,0,0,15,5,10,15,5,10,0,0,0
`12,`256,District - Kurung Kumey,`10,`107,`1072,Manufacture of sugar,1,0,1,1,0,1,0,0,0,0,0,0,0,0,0,0,0,0
`12,`256,District - Kurung Kumey,`10,`107,`1075,Manufacture of prepared meals and dishes,31,22,9,31,22,9,0,0,0,13,5,8,13,5,8,0,0,0
`12,`256,District - Kurung Kumey,`10,`107,`1079,Manufacture of other food products n.e.c.,4,2,2,4,2,2,0,0,0,2,0,2,2,0,2,0,0,0
`12,`256,District - Kurung Kumey,`11,`000,`0000,Manufacture of beverages,1,1,0,1,1,0,0,0,0,0,0,0,0,0,0,0,0,0
`12,`256,District - Kurung Kumey,`11,`110,`0000,Manufacture of beverages,1,1,0,1,1,0,0,0,0,0,0,0,0,0,0,0,0,0
`12,`256,District - Kurung Kumey,`11,`110,`1101,"Distilling, rectifying and blending of spirits; ethyl alcohol production",1,1,0,1,1,0,0,0,0,0,0,0,0,0,0,0,0,0
`12,`256,District - Kurung Kumey,`13,`000,`0000,Manufacture of textiles,37,17,20,37,17,20,0,0,0,18,10,8,18,10,8,0,0,0
`12,`256,District - Kurung Kumey,`13,`131,`0000,"Spinning, weaving and finishing of textiles",36,17,19,36,17,19,0,0,0,15,7,8,15,7,8,0,0,0
`12,`256,District - Kurung Kumey,`13,`131,`1311,Preparation and spinning of textile fibres,25,16,9,25,16,9,0,0,0,11,7,4,11,7,4,0,0,0
