State Code,District Code,India/States,Division,Group,Class,NIC Name,Main Workers - Total -  Persons,Main Workers - Total - Males,Main Workers - Total - Females,Main Workers - Rural -  Persons,Main Workers - Rural - Males,Main Workers - Rural - Females,Main Workers - Urban -  Persons,Main Workers - Urban - Males,Main Workers - Urban - Females,Marginal Workers - Total -  Persons,Marginal Workers - Total - Males,Marginal Workers - Total - Females,Marginal Workers - Rural -  Persons,Marginal Workers - Rural - Males,Marginal Workers - Rural - Females,Marginal Workers - Urban -  Persons,Marginal Workers - Urban - Males,Marginal Workers - Urban - Females
`10,`210,District - Kishanganj,`28,`000,`0000,Manufacture of machinery and equipment n.e.c.,0,0,0,0,0,0,0,0,0,1,0,1,1,0,1,0,0,0
`10,`210,District - Kishanganj,`28,`281,`0000,Manufacture of general purpose machinery,0,0,0,0,0,0,0,0,0,1,0,1,1,0,1,0,0,0
`10,`210,District - Kishanganj,`28,`281,`2819,Manufacture of other general-purpose machinery,0,0,0,0,0,0,0,0,0,1,0,1,1,0,1,0,0,0
`10,`210,District - Kishanganj,`30,`000,`0000,Manufacture of other transport equipment,3,3,0,1,1,0,2,2,0,0,0,0,0,0,0,0,0,0
`10,`210,District - Kishanganj,`30,`309,`0000,Manufacture of transport equipment n.e.c.,3,3,0,1,1,0,2,2,0,0,0,0,0,0,0,0,0,0
`10,`210,District - Kishanganj,`30,`309,`3099,Manufacture of other transport equipment n.e.c.,3,3,0,1,1,0,2,2,0,0,0,0,0,0,0,0,0,0
`10,`210,District - Kishanganj,`31,`000,`0000,Manufacture of furniture,6,6,0,6,6,0,0,0,0,1,1,0,1,1,0,0,0,0
`10,`210,District - Kishanganj,`31,`310,`0000,Manufacture of furniture,6,6,0,6,6,0,0,0,0,1,1,0,1,1,0,0,0,0
`10,`210,District - Kishanganj,`31,`310,`3100,Manufacture of furniture,6,6,0,6,6,0,0,0,0,1,1,0,1,1,0,0,0,0
`10,`210,District - Kishanganj,`32,`000,`0000,Other manufacturing,8,6,2,6,6,0,2,0,2,5,4,1,5,4,1,0,0,0
`10,`210,District - Kishanganj,`32,`321,`0000,"Manufacture of jewellery, bijouterie and related articles",3,3,0,3,3,0,0,0,0,0,0,0,0,0,0,0,0,0
`10,`210,District - Kishanganj,`32,`321,`3211,Manufacture of jewellery and related articles,3,3,0,3,3,0,0,0,0,0,0,0,0,0,0,0,0,0
`10,`210,District - Kishanganj,`32,`329,`0000,Other manufacturing n.e.c.,5,3,2,3,3,0,2,0,2,5,4,1,5,4,1,0,0,0
`10,`210,District - Kishanganj,`32,`329,`3290,Other manufacturing n.e.c.,5,3,2,3,3,0,2,0,2,5,4,1,5,4,1,0,0,0
`10,`210,District - Kishanganj,`33,`000,`0000,Repair and installation of machinery and equipment,1,1,0,1,1,0,0,0,0,4,4,0,0,0,0,4,4,0
`10,`210,District - Kishanganj,`33,`331,`0000,"Repair of fabricated metal products, machinery and equipment",1,1,0,1,1,0,0,0,0,4,4,0,0,0,0,4,4,0
`10,`210,District - Kishanganj,`33,`331,`3311,Repair of fabricated metal products,1,1,0,1,1,0,0,0,0,2,2,0,0,0,0,2,2,0
`10,`210,District - Kishanganj,`33,`331,`3312,Repair of machinery,0,0,0,0,0,0,0,0,0,2,2,0,0,0,0,2,2,0
`10,`210,District - Kishanganj,`41,`000,`0000,Construction of buildings,44,43,1,20,19,1,24,24,0,60,42,18,50,36,14,10,6,4
`10,`210,District - Kishanganj,`41,`410,`0000,Construction of buildings,44,43,1,20,19,1,24,24,0,60,42,18,50,36,14,10,6,4
`10,`210,District - Kishanganj,`41,`410,`4100,Construction of buildings,44,43,1,20,19,1,24,24,0,60,42,18,50,36,14,10,6,4
`10,`210,District - Kishanganj,`42,`000,`0000,Civil engineering,20,13,7,8,3,5,12,10,2,39,23,16,39,23,16,0,0,0
`10,`210,District - Kishanganj,`42,`421,`0000,Construction of roads and railways,20,13,7,8,3,5,12,10,2,39,23,16,39,23,16,0,0,0
`10,`210,District - Kishanganj,`42,`421,`4210,Construction roads and railways,20,13,7,8,3,5,12,10,2,39,23,16,39,23,16,0,0,0
`10,`210,District - Kishanganj,`43,`000,`0000,Specialized construction activities,25,23,2,19,19,0,6,4,2,82,64,18,70,54,16,12,10,2
`10,`210,District - Kishanganj,`43,`432,`0000,"Electrical, plumbing and other construction installation activities",22,20,2,18,18,0,4,2,2,82,64,18,70,54,16,12,10,2
`10,`210,District - Kishanganj,`43,`432,`4329,Other construction installation,22,20,2,18,18,0,4,2,2,82,64,18,70,54,16,12,10,2
`10,`210,District - Kishanganj,`43,`433,`0000,Building completion and finishing,3,3,0,1,1,0,2,2,0,0,0,0,0,0,0,0,0,0
`10,`210,District - Kishanganj,`43,`433,`4330,Building completion and finishing,3,3,0,1,1,0,2,2,0,0,0,0,0,0,0,0,0,0
`10,`210,District - Kishanganj,`45,`000,`0000,Wholesale and retail trade and repair of motor vehicles and motorcycles,4,4,0,0,0,0,4,4,0,2,2,0,0,0,0,2,2,0
`10,`210,District - Kishanganj,`45,`452,`0000,Maintenance and repair of motor vehicles,2,2,0,0,0,0,2,2,0,2,2,0,0,0,0,2,2,0
`10,`210,District - Kishanganj,`45,`452,`4520,Maintenance and repair of motor vehicles,2,2,0,0,0,0,2,2,0,2,2,0,0,0,0,2,2,0
`10,`210,District - Kishanganj,`45,`454,`0000,"Sale, maintenance and repair of motorcycles and related parts and",2,2,0,0,0,0,2,2,0,0,0,0,0,0,0,0,0,0
`10,`210,District - Kishanganj,`45,`454,`4540,"Sale, maintenance and repair of motorcycles and related parts and",2,2,0,0,0,0,2,2,0,0,0,0,0,0,0,0,0,0
`10,`210,District - Kishanganj,`46,`000,`0000,"Wholesale trade, except of motor vehicles and motorcycles",2,2,0,2,2,0,0,0,0,0,0,0,0,0,0,0,0,0
`10,`210,District - Kishanganj,`46,`464,`0000,Wholesale of household goods,1,1,0,1,1,0,0,0,0,0,0,0,0,0,0,0,0,0
`10,`210,District - Kishanganj,`46,`464,`4649,Wholesale of other household goods,1,1,0,1,1,0,0,0,0,0,0,0,0,0,0,0,0,0
`10,`210,District - Kishanganj,`46,`469,`0000,Non-specialized wholesale trade,1,1,0,1,1,0,0,0,0,0,0,0,0,0,0,0,0,0
`10,`210,District - Kishanganj,`46,`469,`4690,Non-specialized wholesale trade,1,1,0,1,1,0,0,0,0,0,0,0,0,0,0,0,0,0
`10,`210,District - Kishanganj,`47,`000,`0000,"Retail trade, except of motor vehicles and motorcycles",27,25,2,23,21,2,4,4,0,12,10,2,6,6,0,6,4,2
`10,`210,District - Kishanganj,`47,`471,`0000,Retail sale in non-specialized stores,3,3,0,1,1,0,2,2,0,0,0,0,0,0,0,0,0,0
`10,`210,District - Kishanganj,`47,`471,`4711,"Retail sale in non-specialized stores with food, beverages or tobacco",3,3,0,1,1,0,2,2,0,0,0,0,0,0,0,0,0,0
`10,`210,District - Kishanganj,`47,`472,`0000,"Retail sale of food, beverages and tobacco in specialized stores",19,17,2,17,15,2,2,2,0,4,4,0,4,4,0,0,0,0
`10,`210,District - Kishanganj,`47,`472,`4721,Retail sale of food in specialized stores,19,17,2,17,15,2,2,2,0,4,4,0,4,4,0,0,0,0
`10,`210,District - Kishanganj,`47,`474,`0000,Retail sale of information and communications equipment in specialized,0,0,0,0,0,0,0,0,0,4,4,0,2,2,0,2,2,0
`10,`210,District - Kishanganj,`47,`474,`4741,"Retail sale of computers, peripheral units, software and",0,0,0,0,0,0,0,0,0,4,4,0,2,2,0,2,2,0
`10,`210,District - Kishanganj,`47,`476,`0000,Retail sale of cultural and recreation goods in specialized stores,2,2,0,2,2,0,0,0,0,0,0,0,0,0,0,0,0,0
`10,`210,District - Kishanganj,`47,`476,`4761,"Retail sale of books, newspapers and stationary in specialized stores",2,2,0,2,2,0,0,0,0,0,0,0,0,0,0,0,0,0
`10,`210,District - Kishanganj,`47,`477,`0000,Retail sale of other goods in specialized stores,2,2,0,2,2,0,0,0,0,4,2,2,0,0,0,4,2,2
`10,`210,District - Kishanganj,`47,`477,`4771,"Retail sale of clothing, footwear and leather articles in specialized",0,0,0,0,0,0,0,0,0,2,0,2,0,0,0,2,0,2
`10,`210,District - Kishanganj,`47,`477,`4773,Other retail sale of new goods in specialized stores,2,2,0,2,2,0,0,0,0,2,2,0,0,0,0,2,2,0
`10,`210,District - Kishanganj,`47,`478,`0000,Retail sale via stalls and markets,1,1,0,1,1,0,0,0,0,0,0,0,0,0,0,0,0,0
`10,`210,District - Kishanganj,`47,`478,`4782,"Retail sale via stalls and markets of textiles, clothing and footwear",1,1,0,1,1,0,0,0,0,0,0,0,0,0,0,0,0,0
`10,`210,District - Kishanganj,`49,`000,`0000,Land transport and transport via pipelines,66,65,1,30,29,1,36,36,0,27,26,1,15,14,1,12,12,0
`10,`210,District - Kishanganj,`49,`491,`0000,Transport via railways,22,21,1,10,9,1,12,12,0,0,0,0,0,0,0,0,0,0
`10,`210,District - Kishanganj,`49,`491,`4911,Passenger rail transport,21,21,0,9,9,0,12,12,0,0,0,0,0,0,0,0,0,0
`10,`210,District - Kishanganj,`49,`491,`4912,Freight rail transport,1,0,1,1,0,1,0,0,0,0,0,0,0,0,0,0,0,0
`10,`210,District - Kishanganj,`49,`492,`0000,Other land transport,44,44,0,20,20,0,24,24,0,27,26,1,15,14,1,12,12,0
`10,`210,District - Kishanganj,`49,`492,`4921,Urban or suburban passenger land transport,3,3,0,1,1,0,2,2,0,2,2,0,0,0,0,2,2,0
`10,`210,District - Kishanganj,`49,`492,`4922,Other passenger land transport,21,21,0,7,7,0,14,14,0,15,14,1,11,10,1,4,4,0
`10,`210,District - Kishanganj,`49,`492,`4923,Freight transport by road,20,20,0,12,12,0,8,8,0,10,10,0,4,4,0,6,6,0
`10,`210,District - Kishanganj,`50,`000,`0000,Water transport,1,1,0,1,1,0,0,0,0,0,0,0,0,0,0,0,0,0
`10,`210,District - Kishanganj,`50,`502,`0000,Inland water transport,1,1,0,1,1,0,0,0,0,0,0,0,0,0,0,0,0,0
`10,`210,District - Kishanganj,`50,`502,`5021,Inland passenger water transport,1,1,0,1,1,0,0,0,0,0,0,0,0,0,0,0,0,0
`10,`210,District - Kishanganj,`52,`000,`0000,Warehousing and support activities for transportation,5,5,0,1,1,0,4,4,0,0,0,0,0,0,0,0,0,0
`10,`210,District - Kishanganj,`52,`521,`0000,Warehousing and storage,2,2,0,0,0,0,2,2,0,0,0,0,0,0,0,0,0,0
`10,`210,District - Kishanganj,`52,`521,`5210,Warehousing and storage,2,2,0,0,0,0,2,2,0,0,0,0,0,0,0,0,0,0
`10,`210,District - Kishanganj,`52,`522,`0000,Support activities for transportation,3,3,0,1,1,0,2,2,0,0,0,0,0,0,0,0,0,0
`10,`210,District - Kishanganj,`52,`522,`5221,Service activities incidental to land transportation,3,3,0,1,1,0,2,2,0,0,0,0,0,0,0,0,0,0
`10,`210,District - Kishanganj,`53,`000,`0000,Postal and courier activities,1,1,0,1,1,0,0,0,0,0,0,0,0,0,0,0,0,0
`10,`210,District - Kishanganj,`53,`531,`0000,Postal activities,1,1,0,1,1,0,0,0,0,0,0,0,0,0,0,0,0,0
`10,`210,District - Kishanganj,`53,`531,`5310,Postal activities,1,1,0,1,1,0,0,0,0,0,0,0,0,0,0,0,0,0
`10,`210,District - Kishanganj,`55,`000,`0000,Accommodation,1,1,0,1,1,0,0,0,0,0,0,0,0,0,0,0,0,0
`10,`210,District - Kishanganj,`55,`551,`0000,Short term accommodation activities,1,1,0,1,1,0,0,0,0,0,0,0,0,0,0,0,0,0
`10,`210,District - Kishanganj,`55,`551,`5510,Short term accommodation activities,1,1,0,1,1,0,0,0,0,0,0,0,0,0,0,0,0,0
`10,`210,District - Kishanganj,`56,`000,`0000,Food and beverage service activities,26,15,11,16,11,5,10,4,6,9,2,7,9,2,7,0,0,0
`10,`210,District - Kishanganj,`56,`561,`0000,Restaurants and mobile food service activities,2,0,2,0,0,0,2,0,2,0,0,0,0,0,0,0,0,0
`10,`210,District - Kishanganj,`56,`561,`5610,Restaurants and mobile food service activities,2,0,2,0,0,0,2,0,2,0,0,0,0,0,0,0,0,0
`10,`210,District - Kishanganj,`56,`563,`0000,Beverage serving activities,24,15,9,16,11,5,8,4,4,9,2,7,9,2,7,0,0,0
`10,`210,District - Kishanganj,`56,`563,`5630,Beverage serving activities,24,15,9,16,11,5,8,4,4,9,2,7,9,2,7,0,0,0
`10,`210,District - Kishanganj,`61,`000,`0000,Telecommunications,4,4,0,2,2,0,2,2,0,0,0,0,0,0,0,0,0,0
`10,`210,District - Kishanganj,`61,`611,`0000,Wired telecommunications activities,1,1,0,1,1,0,0,0,0,0,0,0,0,0,0,0,0,0
`10,`210,District - Kishanganj,`61,`611,`6110,Wired telecommunications activities,1,1,0,1,1,0,0,0,0,0,0,0,0,0,0,0,0,0
`10,`210,District - Kishanganj,`61,`612,`0000,Wireless telecommunications activities,1,1,0,1,1,0,0,0,0,0,0,0,0,0,0,0,0,0
`10,`210,District - Kishanganj,`61,`612,`6120,Wireless telecommunications activities,1,1,0,1,1,0,0,0,0,0,0,0,0,0,0,0,0,0
`10,`210,District - Kishanganj,`61,`619,`0000,Other telecommunications activities,2,2,0,0,0,0,2,2,0,0,0,0,0,0,0,0,0,0
`10,`210,District - Kishanganj,`61,`619,`6190,Other telecommunications activities,2,2,0,0,0,0,2,2,0,0,0,0,0,0,0,0,0,0
`10,`210,District - Kishanganj,`62,`000,`0000,"Computer programming, consultancy and related activities",1,1,0,1,1,0,0,0,0,0,0,0,0,0,0,0,0,0
`10,`210,District - Kishanganj,`62,`620,`0000,"Computer programming, consultancy and related activities",1,1,0,1,1,0,0,0,0,0,0,0,0,0,0,0,0,0
`10,`210,District - Kishanganj,`62,`620,`6209,Other information technology and computer service activities,1,1,0,1,1,0,0,0,0,0,0,0,0,0,0,0,0,0
`10,`210,District - Kishanganj,`64,`000,`0000,"Financial service activities, except insurance and pension funding",10,10,0,2,2,0,8,8,0,0,0,0,0,0,0,0,0,0
`10,`210,District - Kishanganj,`64,`641,`0000,Monetary intermediation,10,10,0,2,2,0,8,8,0,0,0,0,0,0,0,0,0,0
`10,`210,District - Kishanganj,`64,`641,`6411,Central banking,2,2,0,0,0,0,2,2,0,0,0,0,0,0,0,0,0,0
`10,`210,District - Kishanganj,`64,`641,`6419,Other monetary intermediation,8,8,0,2,2,0,6,6,0,0,0,0,0,0,0,0,0,0
`10,`210,District - Kishanganj,`69,`000,`0000,Legal and accounting activities,2,2,0,0,0,0,2,2,0,0,0,0,0,0,0,0,0,0
`10,`210,District - Kishanganj,`69,`691,`0000,Legal activities,2,2,0,0,0,0,2,2,0,0,0,0,0,0,0,0,0,0
`10,`210,District - Kishanganj,`69,`691,`6910,Legal activities,2,2,0,0,0,0,2,2,0,0,0,0,0,0,0,0,0,0
`10,`210,District - Kishanganj,`77,`000,`0000,Rental and leasing activities,0,0,0,0,0,0,0,0,0,2,2,0,0,0,0,2,2,0
`10,`210,District - Kishanganj,`77,`772,`0000,Renting and leasing of personal and household goods,0,0,0,0,0,0,0,0,0,2,2,0,0,0,0,2,2,0
`10,`210,District - Kishanganj,`77,`772,`7729,Renting and leasing of other personal and household goods n.e.c.,0,0,0,0,0,0,0,0,0,2,2,0,0,0,0,2,2,0
`10,`210,District - Kishanganj,`80,`000,`0000,Security and investigation activities,4,4,0,2,2,0,2,2,0,0,0,0,0,0,0,0,0,0
`10,`210,District - Kishanganj,`80,`801,`0000,Private security activities,4,4,0,2,2,0,2,2,0,0,0,0,0,0,0,0,0,0
`10,`210,District - Kishanganj,`80,`801,`8010,Private security activities,4,4,0,2,2,0,2,2,0,0,0,0,0,0,0,0,0,0
`10,`210,District - Kishanganj,`81,`000,`0000,Services to buildings and landscape activities,2,2,0,2,2,0,0,0,0,0,0,0,0,0,0,0,0,0
`10,`210,District - Kishanganj,`81,`812,`0000,Cleaning activities,2,2,0,2,2,0,0,0,0,0,0,0,0,0,0,0,0,0
`10,`210,District - Kishanganj,`81,`812,`8129,Other building and industrial cleaning activities,2,2,0,2,2,0,0,0,0,0,0,0,0,0,0,0,0,0
`10,`210,District - Kishanganj,`82,`000,`0000,"Office administrative, office support and other business support activities",4,4,0,2,2,0,2,2,0,0,0,0,0,0,0,0,0,0
`10,`210,District - Kishanganj,`82,`821,`0000,Office administrative and support activities,2,2,0,2,2,0,0,0,0,0,0,0,0,0,0,0,0,0
`10,`210,District - Kishanganj,`82,`821,`8211,Combined office administrative service activities,2,2,0,2,2,0,0,0,0,0,0,0,0,0,0,0,0,0
`10,`210,District - Kishanganj,`82,`829,`0000,Business support service activities n.e.c.,2,2,0,0,0,0,2,2,0,0,0,0,0,0,0,0,0,0
`10,`210,District - Kishanganj,`82,`829,`8299,Other business support service activities n.e.c.,2,2,0,0,0,0,2,2,0,0,0,0,0,0,0,0,0,0
`10,`210,District - Kishanganj,`84,`000,`0000,Public administration and defence; compulsory social security,83,79,4,41,37,4,42,42,0,1,1,0,1,1,0,0,0,0
`10,`210,District - Kishanganj,`84,`841,`0000,Administration of the State and the economic and social policy of the,28,25,3,12,9,3,16,16,0,0,0,0,0,0,0,0,0,0
`10,`210,District - Kishanganj,`84,`841,`8411,General public administration activities,28,25,3,12,9,3,16,16,0,0,0,0,0,0,0,0,0,0
`10,`210,District - Kishanganj,`84,`842,`0000,Provision of services to the community as a whole,55,54,1,29,28,1,26,26,0,1,1,0,1,1,0,0,0,0
`10,`210,District - Kishanganj,`84,`842,`8422,Defence activities,40,40,0,22,22,0,18,18,0,0,0,0,0,0,0,0,0,0
`10,`210,District - Kishanganj,`84,`842,`8423,Public order and safety activities,15,14,1,7,6,1,8,8,0,1,1,0,1,1,0,0,0,0
`10,`210,District - Kishanganj,`85,`000,`0000,Education,116,65,51,60,39,21,56,26,30,12,8,4,4,2,2,8,6,2
`10,`210,District - Kishanganj,`85,`851,`0000,Primary education,95,51,44,45,29,16,50,22,28,4,2,2,4,2,2,0,0,0
`10,`210,District - Kishanganj,`85,`851,`8510,Primary education,95,51,44,45,29,16,50,22,28,4,2,2,4,2,2,0,0,0
`10,`210,District - Kishanganj,`85,`852,`0000,Secondary education,16,12,4,12,8,4,4,4,0,2,0,2,0,0,0,2,0,2
`10,`210,District - Kishanganj,`85,`852,`8521,General secondary education,16,12,4,12,8,4,4,4,0,2,0,2,0,0,0,2,0,2
`10,`210,District - Kishanganj,`85,`853,`0000,Higher education,3,1,2,1,1,0,2,0,2,2,2,0,0,0,0,2,2,0
`10,`210,District - Kishanganj,`85,`853,`8530,Higher education,3,1,2,1,1,0,2,0,2,2,2,0,0,0,0,2,2,0
`10,`210,District - Kishanganj,`85,`854,`0000,Other education,2,1,1,2,1,1,0,0,0,4,4,0,0,0,0,4,4,0
`10,`210,District - Kishanganj,`85,`854,`8549,Other education n.e.c.,2,1,1,2,1,1,0,0,0,4,4,0,0,0,0,4,4,0
`10,`210,District - Kishanganj,`86,`000,`0000,Human health activities,46,9,37,32,7,25,14,2,12,1,0,1,1,0,1,0,0,0
`10,`210,District - Kishanganj,`86,`861,`0000,Hospital activities,12,6,6,6,4,2,6,2,4,0,0,0,0,0,0,0,0,0
`10,`210,District - Kishanganj,`86,`861,`8610,Hospital activities,12,6,6,6,4,2,6,2,4,0,0,0,0,0,0,0,0,0
`10,`210,District - Kishanganj,`86,`862,`0000,Medical and dental practice activities,2,2,0,2,2,0,0,0,0,0,0,0,0,0,0,0,0,0
`10,`210,District - Kishanganj,`86,`862,`8620,Medical and dental practice activities,2,2,0,2,2,0,0,0,0,0,0,0,0,0,0,0,0,0
`10,`210,District - Kishanganj,`86,`869,`0000,Other human health activities,32,1,31,24,1,23,8,0,8,1,0,1,1,0,1,0,0,0
`10,`210,District - Kishanganj,`86,`869,`8690,Other human health activities,32,1,31,24,1,23,8,0,8,1,0,1,1,0,1,0,0,0
`10,`210,District - Kishanganj,`88,`000,`0000,Social work activities without accommodation,2,1,1,2,1,1,0,0,0,0,0,0,0,0,0,0,0,0
`10,`210,District - Kishanganj,`88,`881,`0000,Social work activities without accommodation for the elderly and disabled,1,0,1,1,0,1,0,0,0,0,0,0,0,0,0,0,0,0
`10,`210,District - Kishanganj,`88,`881,`8810,Social work activities without accommodation for the elderly and,1,0,1,1,0,1,0,0,0,0,0,0,0,0,0,0,0,0
`10,`210,District - Kishanganj,`88,`889,`0000,Other social work activities without accommodation n.e.c.,1,1,0,1,1,0,0,0,0,0,0,0,0,0,0,0,0,0
`10,`210,District - Kishanganj,`88,`889,`8890,Other social work activities without accommodation n.e.c.,1,1,0,1,1,0,0,0,0,0,0,0,0,0,0,0,0,0
`10,`210,District - Kishanganj,`94,`000,`0000,Activities of membership organizations,8,7,1,6,5,1,2,2,0,1,1,0,1,1,0,0,0,0
`10,`210,District - Kishanganj,`94,`949,`0000,Activities of other membership organizations,8,7,1,6,5,1,2,2,0,1,1,0,1,1,0,0,0,0
`10,`210,District - Kishanganj,`94,`949,`9491,Activities of religious organizations,4,4,0,4,4,0,0,0,0,1,1,0,1,1,0,0,0,0
`10,`210,District - Kishanganj,`94,`949,`9492,Activities of political organizations,4,3,1,2,1,1,2,2,0,0,0,0,0,0,0,0,0,0
`10,`210,District - Kishanganj,`95,`000,`0000,Repair of computers and personal and household goods,6,6,0,2,2,0,4,4,0,0,0,0,0,0,0,0,0,0
`10,`210,District - Kishanganj,`95,`952,`0000,Repair of personal and household goods,6,6,0,2,2,0,4,4,0,0,0,0,0,0,0,0,0,0
`10,`210,District - Kishanganj,`95,`952,`9529,"Repair of personal and household goods, n.e.c.",6,6,0,2,2,0,4,4,0,0,0,0,0,0,0,0,0,0
`10,`210,District - Kishanganj,`96,`000,`0000,Other personal service activities,11,8,3,7,6,1,4,2,2,7,5,2,1,1,0,6,4,2
`10,`210,District - Kishanganj,`96,`960,`0000,Other personal service activities,11,8,3,7,6,1,4,2,2,7,5,2,1,1,0,6,4,2
`10,`210,District - Kishanganj,`96,`960,`9602,Hairdressing and other beauty treatment,6,6,0,6,6,0,0,0,0,0,0,0,0,0,0,0,0,0
`10,`210,District - Kishanganj,`96,`960,`9609,Other personal service activities n.e.c.,5,2,3,1,0,1,4,2,2,7,5,2,1,1,0,6,4,2
`10,`210,District - Kishanganj,`99,`000,`0000,Activities of extraterritorial organizations and bodies,249,139,110,221,123,98,28,16,12,499,124,375,427,90,337,72,34,38
`10,`210,District - Kishanganj,`99,`991,`0000,Blank,189,120,69,165,104,61,24,16,8,266,60,206,258,56,202,8,4,4
`10,`210,District - Kishanganj,`99,`991,`9910,Blank,189,120,69,165,104,61,24,16,8,266,60,206,258,56,202,8,4,4
`10,`210,District - Kishanganj,`99,`992,`0000,Incomplete description/ Wrongly Classifed,60,19,41,56,19,37,4,0,4,233,64,169,169,34,135,64,30,34
`10,`210,District - Kishanganj,`99,`992,`9920,Incomplete description/ Wrongly Classifed,60,19,41,56,19,37,4,0,4,233,64,169,169,34,135,64,30,34
`10,`211,District - Purnia,`00,`000,`0000,Total,4908,3449,1459,2912,1919,993,1996,1530,466,2625,1380,1245,2053,1018,1035,572,362,210
`10,`211,District - Purnia,`01,`000,`0000,"Crop and animal production, hunting and related service activities",46,43,3,18,15,3,28,28,0,21,5,16,19,3,16,2,2,0
`10,`211,District - Purnia,`01,`012,`0000,Growing of perennial crops,8,8,0,2,2,0,6,6,0,0,0,0,0,0,0,0,0,0
`10,`211,District - Purnia,`01,`012,`0125,Growing of other tree and bush fruits and nuts,6,6,0,0,0,0,6,6,0,0,0,0,0,0,0,0,0,0
`10,`211,District - Purnia,`01,`012,`0126,Growing of oleaginous fruits,1,1,0,1,1,0,0,0,0,0,0,0,0,0,0,0,0,0
`10,`211,District - Purnia,`01,`012,`0129,Growing of other perennial crops,1,1,0,1,1,0,0,0,0,0,0,0,0,0,0,0,0,0
`10,`211,District - Purnia,`01,`013,`0000,Plant propagation,13,13,0,1,1,0,12,12,0,0,0,0,0,0,0,0,0,0
`10,`211,District - Purnia,`01,`013,`0130,Plant propagation,13,13,0,1,1,0,12,12,0,0,0,0,0,0,0,0,0,0
`10,`211,District - Purnia,`01,`014,`0000,Animal production,23,20,3,13,10,3,10,10,0,21,5,16,19,3,16,2,2,0
`10,`211,District - Purnia,`01,`014,`0141,Raising of cattle and buffaloes,19,18,1,9,8,1,10,10,0,14,4,10,12,2,10,2,2,0
`10,`211,District - Purnia,`01,`014,`0144,Raising of sheep and goats,2,0,2,2,0,2,0,0,0,4,0,4,4,0,4,0,0,0
`10,`211,District - Purnia,`01,`014,`0145,Raising of swine/pigs,1,1,0,1,1,0,0,0,0,1,0,1,1,0,1,0,0,0
`10,`211,District - Purnia,`01,`014,`0146,Raising of poultry,0,0,0,0,0,0,0,0,0,2,1,1,2,1,1,0,0,0
`10,`211,District - Purnia,`01,`014,`0149,Raising of other animals,1,1,0,1,1,0,0,0,0,0,0,0,0,0,0,0,0,0
`10,`211,District - Purnia,`01,`016,`0000,Support activities to agriculture and post-harvest crop activities,1,1,0,1,1,0,0,0,0,0,0,0,0,0,0,0,0,0
`10,`211,District - Purnia,`01,`016,`0161,Support activities for crop production,1,1,0,1,1,0,0,0,0,0,0,0,0,0,0,0,0,0
`10,`211,District - Purnia,`01,`017,`0000,"Hunting, trapping and related service activities",1,1,0,1,1,0,0,0,0,0,0,0,0,0,0,0,0,0
`10,`211,District - Purnia,`01,`017,`0170,"Hunting, trapping and related service activities",1,1,0,1,1,0,0,0,0,0,0,0,0,0,0,0,0,0
`10,`211,District - Purnia,`02,`000,`0000,Forestry and logging,12,10,2,0,0,0,12,10,2,6,6,0,4,4,0,2,2,0
`10,`211,District - Purnia,`02,`021,`0000,Silviculture and other forestry activities,10,10,0,0,0,0,10,10,0,2,2,0,0,0,0,2,2,0
`10,`211,District - Purnia,`02,`021,`0210,Silviculture and other forestry activities,10,10,0,0,0,0,10,10,0,2,2,0,0,0,0,2,2,0
`10,`211,District - Purnia,`02,`022,`0000,Logging,2,0,2,0,0,0,2,0,2,4,4,0,4,4,0,0,0,0
`10,`211,District - Purnia,`02,`022,`0220,Logging,2,0,2,0,0,0,2,0,2,4,4,0,4,4,0,0,0,0
`10,`211,District - Purnia,`03,`000,`0000,Fishing and aquaculture,0,0,0,0,0,0,0,0,0,11,10,1,11,10,1,0,0,0
`10,`211,District - Purnia,`03,`031,`0000,Fishing,0,0,0,0,0,0,0,0,0,11,10,1,11,10,1,0,0,0
`10,`211,District - Purnia,`03,`031,`0312,Freash water fishing,0,0,0,0,0,0,0,0,0,11,10,1,11,10,1,0,0,0
`10,`211,District - Purnia,`08,`000,`0000,Other mining and quarrying,5,4,1,5,4,1,0,0,0,0,0,0,0,0,0,0,0,0
`10,`211,District - Purnia,`08,`081,`0000,"Quarrying of stone, sand and clay",5,4,1,5,4,1,0,0,0,0,0,0,0,0,0,0,0,0
`10,`211,District - Purnia,`08,`081,`0810,"Quarrying of stone, sand and clay",5,4,1,5,4,1,0,0,0,0,0,0,0,0,0,0,0,0
`10,`211,District - Purnia,`10,`000,`0000,Manufacture of food products,204,116,88,196,108,88,8,8,0,78,25,53,74,25,49,4,0,4
`10,`211,District - Purnia,`10,`101,`0000,Processing and preserving of meat,4,2,2,4,2,2,0,0,0,10,2,8,10,2,8,0,0,0
`10,`211,District - Purnia,`10,`101,`1010,Processing and preserving of meat,4,2,2,4,2,2,0,0,0,10,2,8,10,2,8,0,0,0
`10,`211,District - Purnia,`10,`105,`0000,Manufacture of dairy products,158,79,79,158,79,79,0,0,0,56,20,36,54,20,34,2,0,2
`10,`211,District - Purnia,`10,`105,`1050,Manufacture of dairy products,158,79,79,158,79,79,0,0,0,56,20,36,54,20,34,2,0,2
`10,`211,District - Purnia,`10,`106,`0000,"Manufacture of grain mill products, starches and starch products",17,16,1,11,10,1,6,6,0,1,0,1,1,0,1,0,0,0
`10,`211,District - Purnia,`10,`106,`1061,Manufacture of grain mill products,17,16,1,11,10,1,6,6,0,1,0,1,1,0,1,0,0,0
`10,`211,District - Purnia,`10,`107,`0000,Manufacture of other food products,24,18,6,22,16,6,2,2,0,9,3,6,7,3,4,2,0,2
`10,`211,District - Purnia,`10,`107,`1071,Manufacture of bakery products,3,3,0,3,3,0,0,0,0,0,0,0,0,0,0,0,0,0
`10,`211,District - Purnia,`10,`107,`1073,"Manufacture of cocoa, chocolate and sugar confectionery",4,4,0,2,2,0,2,2,0,0,0,0,0,0,0,0,0,0
`10,`211,District - Purnia,`10,`107,`1075,Manufacture of prepared meals and dishes,11,7,4,11,7,4,0,0,0,7,2,5,5,2,3,2,0,2
`10,`211,District - Purnia,`10,`107,`1079,Manufacture of other food products n.e.c.,6,4,2,6,4,2,0,0,0,2,1,1,2,1,1,0,0,0
`10,`211,District - Purnia,`10,`108,`0000,Manufacture of prepared animal feeds,1,1,0,1,1,0,0,0,0,2,0,2,2,0,2,0,0,0
`10,`211,District - Purnia,`10,`108,`1080,Manufacture of prepared animal feeds,1,1,0,1,1,0,0,0,0,2,0,2,2,0,2,0,0,0
`10,`211,District - Purnia,`11,`000,`0000,Manufacture of beverages,8,5,3,6,3,3,2,2,0,1,0,1,1,0,1,0,0,0
`10,`211,District - Purnia,`11,`110,`0000,Manufacture of beverages,8,5,3,6,3,3,2,2,0,1,0,1,1,0,1,0,0,0
`10,`211,District - Purnia,`11,`110,`1103,Manufacture of malt liquors and malt,5,2,3,3,0,3,2,2,0,1,0,1,1,0,1,0,0,0
`10,`211,District - Purnia,`11,`110,`1104,Manufacture of soft drinks; production of mineral waters and other,3,3,0,3,3,0,0,0,0,0,0,0,0,0,0,0,0,0
`10,`211,District - Purnia,`12,`000,`0000,Manufacture of tobacco products,2,2,0,0,0,0,2,2,0,0,0,0,0,0,0,0,0,0
`10,`211,District - Purnia,`12,`120,`0000,Manufacture of tobacco products,2,2,0,0,0,0,2,2,0,0,0,0,0,0,0,0,0,0
`10,`211,District - Purnia,`12,`120,`1200,Manufacture of tobacco products,2,2,0,0,0,0,2,2,0,0,0,0,0,0,0,0,0,0
`10,`211,District - Purnia,`13,`000,`0000,Manufacture of textiles,67,48,19,59,40,19,8,8,0,109,69,40,99,65,34,10,4,6
`10,`211,District - Purnia,`13,`131,`0000,"Spinning, weaving and finishing of textiles",67,48,19,59,40,19,8,8,0,109,69,40,99,65,34,10,4,6
`10,`211,District - Purnia,`13,`131,`1311,Preparation and spinning of textile fibres,65,46,19,59,40,19,6,6,0,108,68,40,98,64,34,10,4,6
`10,`211,District - Purnia,`13,`131,`1312,Weaving of textiles,2,2,0,0,0,0,2,2,0,1,1,0,1,1,0,0,0,0
`10,`211,District - Purnia,`14,`000,`0000,Manufacture of wearing apparel,17,16,1,13,12,1,4,4,0,6,4,2,6,4,2,0,0,0
