State Code,District Code,India/States,Division,Group,Class,NIC Name,Main Workers - Total -  Persons,Main Workers - Total - Males,Main Workers - Total - Females,Main Workers - Rural -  Persons,Main Workers - Rural - Males,Main Workers - Rural - Females,Main Workers - Urban -  Persons,Main Workers - Urban - Males,Main Workers - Urban - Females,Marginal Workers - Total -  Persons,Marginal Workers - Total - Males,Marginal Workers - Total - Females,Marginal Workers - Rural -  Persons,Marginal Workers - Rural - Males,Marginal Workers - Rural - Females,Marginal Workers - Urban -  Persons,Marginal Workers - Urban - Males,Marginal Workers - Urban - Females
`12,`247,District - East Kameng,`47,`477,`0000,Retail sale of other goods in specialized stores,162,102,60,37,16,21,125,86,39,31,12,19,15,8,7,16,4,12
`12,`247,District - East Kameng,`47,`477,`4771,"Retail sale of clothing, footwear and leather articles in specialized",113,66,47,20,6,14,93,60,33,15,8,7,8,4,4,7,4,3
`12,`247,District - East Kameng,`47,`477,`4772,"Retail sale of pharmaceutical and medical goods, cosmetic and toilet",31,27,4,11,9,2,20,18,2,6,3,3,6,3,3,0,0,0
`12,`247,District - East Kameng,`47,`477,`4773,Other retail sale of new goods in specialized stores,17,9,8,6,1,5,11,8,3,10,1,9,1,1,0,9,0,9
`12,`247,District - East Kameng,`47,`477,`4774,Retail sale of second-hand goods,1,0,1,0,0,0,1,0,1,0,0,0,0,0,0,0,0,0
`12,`247,District - East Kameng,`47,`478,`0000,Retail sale via stalls and markets,16,12,4,7,4,3,9,8,1,2,1,1,2,1,1,0,0,0
`12,`247,District - East Kameng,`47,`478,`4782,"Retail sale via stalls and markets of textiles, clothing and footwear",1,1,0,1,1,0,0,0,0,0,0,0,0,0,0,0,0,0
`12,`247,District - East Kameng,`47,`478,`4789,Retail sale via stalls and markets of other goods,15,11,4,6,3,3,9,8,1,2,1,1,2,1,1,0,0,0
`12,`247,District - East Kameng,`47,`479,`0000,"Retail trade not in stores, stalls or markets",10,3,7,0,0,0,10,3,7,0,0,0,0,0,0,0,0,0
`12,`247,District - East Kameng,`47,`479,`4799,"Other retail sale not in stores, stalls or markets",10,3,7,0,0,0,10,3,7,0,0,0,0,0,0,0,0,0
`12,`247,District - East Kameng,`49,`000,`0000,Land transport and transport via pipelines,169,168,1,55,55,0,114,113,1,19,19,0,13,13,0,6,6,0
`12,`247,District - East Kameng,`49,`492,`0000,Other land transport,169,168,1,55,55,0,114,113,1,19,19,0,13,13,0,6,6,0
`12,`247,District - East Kameng,`49,`492,`4921,Urban or suburban passenger land transport,34,34,0,9,9,0,25,25,0,3,3,0,2,2,0,1,1,0
`12,`247,District - East Kameng,`49,`492,`4922,Other passenger land transport,107,106,1,35,35,0,72,71,1,14,14,0,9,9,0,5,5,0
`12,`247,District - East Kameng,`49,`492,`4923,Freight transport by road,28,28,0,11,11,0,17,17,0,2,2,0,2,2,0,0,0,0
`12,`247,District - East Kameng,`52,`000,`0000,Warehousing and support activities for transportation,20,19,1,9,9,0,11,10,1,4,4,0,1,1,0,3,3,0
`12,`247,District - East Kameng,`52,`521,`0000,Warehousing and storage,2,2,0,0,0,0,2,2,0,0,0,0,0,0,0,0,0,0
`12,`247,District - East Kameng,`52,`521,`5210,Warehousing and storage,2,2,0,0,0,0,2,2,0,0,0,0,0,0,0,0,0,0
`12,`247,District - East Kameng,`52,`522,`0000,Support activities for transportation,18,17,1,9,9,0,9,8,1,4,4,0,1,1,0,3,3,0
`12,`247,District - East Kameng,`52,`522,`5221,Service activities incidental to land transportation,16,15,1,7,7,0,9,8,1,4,4,0,1,1,0,3,3,0
`12,`247,District - East Kameng,`52,`522,`5229,Other transportation support activities,2,2,0,2,2,0,0,0,0,0,0,0,0,0,0,0,0,0
`12,`247,District - East Kameng,`53,`000,`0000,Postal and courier activities,19,15,4,12,8,4,7,7,0,0,0,0,0,0,0,0,0,0
`12,`247,District - East Kameng,`53,`531,`0000,Postal activities,19,15,4,12,8,4,7,7,0,0,0,0,0,0,0,0,0,0
`12,`247,District - East Kameng,`53,`531,`5310,Postal activities,19,15,4,12,8,4,7,7,0,0,0,0,0,0,0,0,0,0
`12,`247,District - East Kameng,`55,`000,`0000,Accommodation,56,43,13,15,13,2,41,30,11,7,2,5,6,2,4,1,0,1
`12,`247,District - East Kameng,`55,`551,`0000,Short term accommodation activities,53,41,12,13,11,2,40,30,10,7,2,5,6,2,4,1,0,1
`12,`247,District - East Kameng,`55,`551,`5510,Short term accommodation activities,53,41,12,13,11,2,40,30,10,7,2,5,6,2,4,1,0,1
`12,`247,District - East Kameng,`55,`559,`0000,Other accommodation,3,2,1,2,2,0,1,0,1,0,0,0,0,0,0,0,0,0
`12,`247,District - East Kameng,`55,`559,`5590,Other accommodation,3,2,1,2,2,0,1,0,1,0,0,0,0,0,0,0,0,0
`12,`247,District - East Kameng,`56,`000,`0000,Food and beverage service activities,14,12,2,4,2,2,10,10,0,3,0,3,1,0,1,2,0,2
`12,`247,District - East Kameng,`56,`562,`0000,Event catering and other food service activities,1,1,0,1,1,0,0,0,0,0,0,0,0,0,0,0,0,0
`12,`247,District - East Kameng,`56,`562,`5621,Event catering,1,1,0,1,1,0,0,0,0,0,0,0,0,0,0,0,0,0
`12,`247,District - East Kameng,`56,`563,`0000,Beverage serving activities,13,11,2,3,1,2,10,10,0,3,0,3,1,0,1,2,0,2
`12,`247,District - East Kameng,`56,`563,`5630,Beverage serving activities,13,11,2,3,1,2,10,10,0,3,0,3,1,0,1,2,0,2
`12,`247,District - East Kameng,`58,`000,`0000,Publishing activities,3,3,0,0,0,0,3,3,0,0,0,0,0,0,0,0,0,0
`12,`247,District - East Kameng,`58,`581,`0000,"Publishing of books, periodicals and other publishing activities",3,3,0,0,0,0,3,3,0,0,0,0,0,0,0,0,0,0
`12,`247,District - East Kameng,`58,`581,`5811,Book publishing,1,1,0,0,0,0,1,1,0,0,0,0,0,0,0,0,0,0
`12,`247,District - East Kameng,`58,`581,`5812,Publishing of directories and mailing lists,1,1,0,0,0,0,1,1,0,0,0,0,0,0,0,0,0,0
`12,`247,District - East Kameng,`58,`581,`5813,"Publishing of newspapers, journals and periodicals",1,1,0,0,0,0,1,1,0,0,0,0,0,0,0,0,0,0
`12,`247,District - East Kameng,`61,`000,`0000,Telecommunications,19,17,2,5,5,0,14,12,2,1,1,0,1,1,0,0,0,0
`12,`247,District - East Kameng,`61,`611,`0000,Wired telecommunications activities,7,7,0,2,2,0,5,5,0,1,1,0,1,1,0,0,0,0
`12,`247,District - East Kameng,`61,`611,`6110,Wired telecommunications activities,7,7,0,2,2,0,5,5,0,1,1,0,1,1,0,0,0,0
`12,`247,District - East Kameng,`61,`612,`0000,Wireless telecommunications activities,1,1,0,1,1,0,0,0,0,0,0,0,0,0,0,0,0,0
`12,`247,District - East Kameng,`61,`612,`6120,Wireless telecommunications activities,1,1,0,1,1,0,0,0,0,0,0,0,0,0,0,0,0,0
`12,`247,District - East Kameng,`61,`619,`0000,Other telecommunications activities,11,9,2,2,2,0,9,7,2,0,0,0,0,0,0,0,0,0
`12,`247,District - East Kameng,`61,`619,`6190,Other telecommunications activities,11,9,2,2,2,0,9,7,2,0,0,0,0,0,0,0,0,0
`12,`247,District - East Kameng,`62,`000,`0000,"Computer programming, consultancy and related activities",1,1,0,0,0,0,1,1,0,0,0,0,0,0,0,0,0,0
`12,`247,District - East Kameng,`62,`620,`0000,"Computer programming, consultancy and related activities",1,1,0,0,0,0,1,1,0,0,0,0,0,0,0,0,0,0
`12,`247,District - East Kameng,`62,`620,`6202,Computer consultancy and computer facilities management activities,1,1,0,0,0,0,1,1,0,0,0,0,0,0,0,0,0,0
`12,`247,District - East Kameng,`63,`000,`0000,Information service activities,3,2,1,0,0,0,3,2,1,0,0,0,0,0,0,0,0,0
`12,`247,District - East Kameng,`63,`631,`0000,"Data processing, hosting and related activities; web portals",3,2,1,0,0,0,3,2,1,0,0,0,0,0,0,0,0,0
`12,`247,District - East Kameng,`63,`631,`6311,"Data processing, hosting and related activities",3,2,1,0,0,0,3,2,1,0,0,0,0,0,0,0,0,0
`12,`247,District - East Kameng,`64,`000,`0000,"Financial service activities, except insurance and pension funding",22,20,2,7,6,1,15,14,1,1,0,1,1,0,1,0,0,0
`12,`247,District - East Kameng,`64,`641,`0000,Monetary intermediation,22,20,2,7,6,1,15,14,1,1,0,1,1,0,1,0,0,0
`12,`247,District - East Kameng,`64,`641,`6419,Other monetary intermediation,22,20,2,7,6,1,15,14,1,1,0,1,1,0,1,0,0,0
`12,`247,District - East Kameng,`65,`000,`0000,"Insurance, reinsurance and pension funding, except compulsory social",1,0,1,1,0,1,0,0,0,0,0,0,0,0,0,0,0,0
`12,`247,District - East Kameng,`65,`651,`0000,Insurance,1,0,1,1,0,1,0,0,0,0,0,0,0,0,0,0,0,0
`12,`247,District - East Kameng,`65,`651,`6511,Life insurance,1,0,1,1,0,1,0,0,0,0,0,0,0,0,0,0,0,0
`12,`247,District - East Kameng,`69,`000,`0000,Legal and accounting activities,6,6,0,3,3,0,3,3,0,2,2,0,2,2,0,0,0,0
`12,`247,District - East Kameng,`69,`691,`0000,Legal activities,6,6,0,3,3,0,3,3,0,2,2,0,2,2,0,0,0,0
`12,`247,District - East Kameng,`69,`691,`6910,Legal activities,6,6,0,3,3,0,3,3,0,2,2,0,2,2,0,0,0,0
`12,`247,District - East Kameng,`74,`000,`0000,"Other professional, scientific and technical activities",2,2,0,0,0,0,2,2,0,0,0,0,0,0,0,0,0,0
`12,`247,District - East Kameng,`74,`742,`0000,Photographic activities,2,2,0,0,0,0,2,2,0,0,0,0,0,0,0,0,0,0
`12,`247,District - East Kameng,`74,`742,`7420,Photographic activities,2,2,0,0,0,0,2,2,0,0,0,0,0,0,0,0,0,0
`12,`247,District - East Kameng,`75,`000,`0000,Veterinary activities,21,16,5,11,9,2,10,7,3,0,0,0,0,0,0,0,0,0
`12,`247,District - East Kameng,`75,`750,`0000,Veterinary activities,21,16,5,11,9,2,10,7,3,0,0,0,0,0,0,0,0,0
`12,`247,District - East Kameng,`75,`750,`7500,Veterinary activities,21,16,5,11,9,2,10,7,3,0,0,0,0,0,0,0,0,0
`12,`247,District - East Kameng,`77,`000,`0000,Rental and leasing activities,1,1,0,0,0,0,1,1,0,0,0,0,0,0,0,0,0,0
`12,`247,District - East Kameng,`77,`771,`0000,Renting and leasing of motor vehicles,1,1,0,0,0,0,1,1,0,0,0,0,0,0,0,0,0,0
`12,`247,District - East Kameng,`77,`771,`7710,Renting and leasing of motor vehicles,1,1,0,0,0,0,1,1,0,0,0,0,0,0,0,0,0,0
`12,`247,District - East Kameng,`79,`000,`0000,"Travel agency, tour operator and other reservation service activities",2,1,1,2,1,1,0,0,0,0,0,0,0,0,0,0,0,0
`12,`247,District - East Kameng,`79,`791,`0000,Travel agency and tour operator activities,2,1,1,2,1,1,0,0,0,0,0,0,0,0,0,0,0,0
`12,`247,District - East Kameng,`79,`791,`7911,Travel agency activities,1,1,0,1,1,0,0,0,0,0,0,0,0,0,0,0,0,0
`12,`247,District - East Kameng,`79,`791,`7912,Tour operator activities,1,0,1,1,0,1,0,0,0,0,0,0,0,0,0,0,0,0
`12,`247,District - East Kameng,`80,`000,`0000,Security and investigation activities,1,1,0,0,0,0,1,1,0,0,0,0,0,0,0,0,0,0
`12,`247,District - East Kameng,`80,`801,`0000,Private security activities,1,1,0,0,0,0,1,1,0,0,0,0,0,0,0,0,0,0
`12,`247,District - East Kameng,`80,`801,`8010,Private security activities,1,1,0,0,0,0,1,1,0,0,0,0,0,0,0,0,0,0
`12,`247,District - East Kameng,`82,`000,`0000,"Office administrative, office support and other business support activities",126,98,28,75,54,21,51,44,7,11,6,5,10,5,5,1,1,0
`12,`247,District - East Kameng,`82,`821,`0000,Office administrative and support activities,10,6,4,7,5,2,3,1,2,0,0,0,0,0,0,0,0,0
`12,`247,District - East Kameng,`82,`821,`8211,Combined office administrative service activities,3,2,1,2,2,0,1,0,1,0,0,0,0,0,0,0,0,0
`12,`247,District - East Kameng,`82,`821,`8219,"Photocopying, document preparation and other specialized office",7,4,3,5,3,2,2,1,1,0,0,0,0,0,0,0,0,0
`12,`247,District - East Kameng,`82,`829,`0000,Business support service activities n.e.c.,116,92,24,68,49,19,48,43,5,11,6,5,10,5,5,1,1,0
`12,`247,District - East Kameng,`82,`829,`8292,Packaging activities,1,1,0,0,0,0,1,1,0,0,0,0,0,0,0,0,0,0
`12,`247,District - East Kameng,`82,`829,`8299,Other business support service activities n.e.c.,115,91,24,68,49,19,47,42,5,11,6,5,10,5,5,1,1,0
`12,`247,District - East Kameng,`84,`000,`0000,Public administration and defence; compulsory social security,1688,1367,321,699,575,124,989,792,197,34,25,9,26,19,7,8,6,2
`12,`247,District - East Kameng,`84,`841,`0000,Administration of the State and the economic and social policy of the,1191,906,285,498,387,111,693,519,174,23,14,9,18,11,7,5,3,2
`12,`247,District - East Kameng,`84,`841,`8411,General public administration activities,1188,903,285,498,387,111,690,516,174,23,14,9,18,11,7,5,3,2
`12,`247,District - East Kameng,`84,`841,`8412,"Regulation of the activities of providing health care, education, cultural",1,1,0,0,0,0,1,1,0,0,0,0,0,0,0,0,0,0
`12,`247,District - East Kameng,`84,`841,`8413,Regulation of and contribution to more efficient operation of,2,2,0,0,0,0,2,2,0,0,0,0,0,0,0,0,0,0
`12,`247,District - East Kameng,`84,`842,`0000,Provision of services to the community as a whole,425,399,26,185,174,11,240,225,15,10,10,0,8,8,0,2,2,0
`12,`247,District - East Kameng,`84,`842,`8421,Foreign affairs,1,1,0,1,1,0,0,0,0,0,0,0,0,0,0,0,0,0
`12,`247,District - East Kameng,`84,`842,`8422,Defence activities,196,189,7,64,59,5,132,130,2,3,3,0,2,2,0,1,1,0
`12,`247,District - East Kameng,`84,`842,`8423,Public order and safety activities,228,209,19,120,114,6,108,95,13,7,7,0,6,6,0,1,1,0
`12,`247,District - East Kameng,`84,`843,`0000,Compulsory social security activities,72,62,10,16,14,2,56,48,8,1,1,0,0,0,0,1,1,0
`12,`247,District - East Kameng,`84,`843,`8430,Compulsory social security activities,72,62,10,16,14,2,56,48,8,1,1,0,0,0,0,1,1,0
`12,`247,District - East Kameng,`85,`000,`0000,Education,1125,853,272,659,504,155,466,349,117,52,31,21,32,17,15,20,14,6
`12,`247,District - East Kameng,`85,`851,`0000,Primary education,603,470,133,354,287,67,249,183,66,24,12,12,21,11,10,3,1,2
`12,`247,District - East Kameng,`85,`851,`8510,Primary education,603,470,133,354,287,67,249,183,66,24,12,12,21,11,10,3,1,2
`12,`247,District - East Kameng,`85,`852,`0000,Secondary education,391,280,111,227,159,68,164,121,43,9,7,2,6,4,2,3,3,0
`12,`247,District - East Kameng,`85,`852,`8521,General secondary education,390,279,111,227,159,68,163,120,43,9,7,2,6,4,2,3,3,0
`12,`247,District - East Kameng,`85,`852,`8522,Technical and vocational secondary education,1,1,0,0,0,0,1,1,0,0,0,0,0,0,0,0,0,0
`12,`247,District - East Kameng,`85,`853,`0000,Higher education,10,4,6,8,4,4,2,0,2,0,0,0,0,0,0,0,0,0
`12,`247,District - East Kameng,`85,`853,`8530,Higher education,10,4,6,8,4,4,2,0,2,0,0,0,0,0,0,0,0,0
`12,`247,District - East Kameng,`85,`854,`0000,Other education,46,40,6,24,20,4,22,20,2,19,12,7,5,2,3,14,10,4
`12,`247,District - East Kameng,`85,`854,`8541,Sports and recreation education,4,4,0,1,1,0,3,3,0,0,0,0,0,0,0,0,0,0
`12,`247,District - East Kameng,`85,`854,`8549,Other education n.e.c.,42,36,6,23,19,4,19,17,2,19,12,7,5,2,3,14,10,4
`12,`247,District - East Kameng,`85,`855,`0000,Educational support services,75,59,16,46,34,12,29,25,4,0,0,0,0,0,0,0,0,0
`12,`247,District - East Kameng,`85,`855,`8550,Educational support services,75,59,16,46,34,12,29,25,4,0,0,0,0,0,0,0,0,0
`12,`247,District - East Kameng,`86,`000,`0000,Human health activities,388,179,209,196,78,118,192,101,91,20,4,16,15,3,12,5,1,4
`12,`247,District - East Kameng,`86,`861,`0000,Hospital activities,201,118,83,94,53,41,107,65,42,5,3,2,3,2,1,2,1,1
`12,`247,District - East Kameng,`86,`861,`8610,Hospital activities,201,118,83,94,53,41,107,65,42,5,3,2,3,2,1,2,1,1
`12,`247,District - East Kameng,`86,`862,`0000,Medical and dental practice activities,14,14,0,7,7,0,7,7,0,0,0,0,0,0,0,0,0,0
`12,`247,District - East Kameng,`86,`862,`8620,Medical and dental practice activities,14,14,0,7,7,0,7,7,0,0,0,0,0,0,0,0,0,0
`12,`247,District - East Kameng,`86,`869,`0000,Other human health activities,173,47,126,95,18,77,78,29,49,15,1,14,12,1,11,3,0,3
`12,`247,District - East Kameng,`86,`869,`8690,Other human health activities,173,47,126,95,18,77,78,29,49,15,1,14,12,1,11,3,0,3
`12,`247,District - East Kameng,`88,`000,`0000,Social work activities without accommodation,14,8,6,9,5,4,5,3,2,0,0,0,0,0,0,0,0,0
`12,`247,District - East Kameng,`88,`889,`0000,Other social work activities without accommodation n.e.c.,14,8,6,9,5,4,5,3,2,0,0,0,0,0,0,0,0,0
`12,`247,District - East Kameng,`88,`889,`8890,Other social work activities without accommodation n.e.c.,14,8,6,9,5,4,5,3,2,0,0,0,0,0,0,0,0,0
`12,`247,District - East Kameng,`91,`000,`0000,"Libraries, archives, museums and other cultural activities",2,2,0,0,0,0,2,2,0,0,0,0,0,0,0,0,0,0
`12,`247,District - East Kameng,`91,`910,`0000,"Libraries, archives, museums and other cultural activities",2,2,0,0,0,0,2,2,0,0,0,0,0,0,0,0,0,0
`12,`247,District - East Kameng,`91,`910,`9101,Library and archives activities,2,2,0,0,0,0,2,2,0,0,0,0,0,0,0,0,0,0
`12,`247,District - East Kameng,`92,`000,`0000,Gambling and betting activities,1,1,0,0,0,0,1,1,0,0,0,0,0,0,0,0,0,0
`12,`247,District - East Kameng,`92,`920,`0000,Gambling and betting activities,1,1,0,0,0,0,1,1,0,0,0,0,0,0,0,0,0,0
`12,`247,District - East Kameng,`92,`920,`9200,Gambling and betting activities,1,1,0,0,0,0,1,1,0,0,0,0,0,0,0,0,0,0
`12,`247,District - East Kameng,`93,`000,`0000,Sports activities and amusement and recreation activities,2,1,1,0,0,0,2,1,1,1,1,0,1,1,0,0,0,0
`12,`247,District - East Kameng,`93,`931,`0000,Sports activities,2,1,1,0,0,0,2,1,1,1,1,0,1,1,0,0,0,0
`12,`247,District - East Kameng,`93,`931,`9311,Operation of sports facilities,0,0,0,0,0,0,0,0,0,1,1,0,1,1,0,0,0,0
`12,`247,District - East Kameng,`93,`931,`9319,Other sports activities,2,1,1,0,0,0,2,1,1,0,0,0,0,0,0,0,0,0
`12,`247,District - East Kameng,`94,`000,`0000,Activities of membership organizations,131,101,30,87,64,23,44,37,7,13,10,3,7,6,1,6,4,2
`12,`247,District - East Kameng,`94,`941,`0000,"Activities of business, employers and professional membership",2,1,1,1,1,0,1,0,1,0,0,0,0,0,0,0,0,0
`12,`247,District - East Kameng,`94,`941,`9411,Activities of business and employers membership organizations,2,1,1,1,1,0,1,0,1,0,0,0,0,0,0,0,0,0
`12,`247,District - East Kameng,`94,`949,`0000,Activities of other membership organizations,129,100,29,86,63,23,43,37,6,13,10,3,7,6,1,6,4,2
`12,`247,District - East Kameng,`94,`949,`9491,Activities of religious organizations,13,12,1,9,8,1,4,4,0,2,2,0,2,2,0,0,0,0
`12,`247,District - East Kameng,`94,`949,`9492,Activities of political organizations,105,80,25,68,48,20,37,32,5,8,6,2,4,3,1,4,3,1
`12,`247,District - East Kameng,`94,`949,`9499,Activities of other membership organizations n.e.c.,11,8,3,9,7,2,2,1,1,3,2,1,1,1,0,2,1,1
`12,`247,District - East Kameng,`95,`000,`0000,Repair of computers and personal and household goods,17,16,1,1,1,0,16,15,1,3,0,3,2,0,2,1,0,1
`12,`247,District - East Kameng,`95,`952,`0000,Repair of personal and household goods,17,16,1,1,1,0,16,15,1,3,0,3,2,0,2,1,0,1
`12,`247,District - East Kameng,`95,`952,`9521,Repair of consumer electronics,0,0,0,0,0,0,0,0,0,1,0,1,1,0,1,0,0,0
`12,`247,District - East Kameng,`95,`952,`9522,Repair of household appliances and home and garden equipment,7,7,0,0,0,0,7,7,0,0,0,0,0,0,0,0,0,0
`12,`247,District - East Kameng,`95,`952,`9523,Repair of footwear and leather goods,4,4,0,0,0,0,4,4,0,0,0,0,0,0,0,0,0,0
`12,`247,District - East Kameng,`95,`952,`9529,"Repair of personal and household goods, n.e.c.",6,5,1,1,1,0,5,4,1,2,0,2,1,0,1,1,0,1
`12,`247,District - East Kameng,`96,`000,`0000,Other personal service activities,50,37,13,8,4,4,42,33,9,8,2,6,3,0,3,5,2,3
`12,`247,District - East Kameng,`96,`960,`0000,Other personal service activities,50,37,13,8,4,4,42,33,9,8,2,6,3,0,3,5,2,3
`12,`247,District - East Kameng,`96,`960,`9601,Washing and (dry-) cleaning of textile and fur products,1,1,0,1,1,0,0,0,0,0,0,0,0,0,0,0,0,0
`12,`247,District - East Kameng,`96,`960,`9602,Hairdressing and other beauty treatment,26,21,5,3,1,2,23,20,3,2,0,2,0,0,0,2,0,2
`12,`247,District - East Kameng,`96,`960,`9609,Other personal service activities n.e.c.,23,15,8,4,2,2,19,13,6,6,2,4,3,0,3,3,2,1
`12,`247,District - East Kameng,`97,`000,`0000,Activities of households as employers of domestic personnel,91,26,65,24,6,18,67,20,47,53,8,45,39,7,32,14,1,13
`12,`247,District - East Kameng,`97,`970,`0000,Activities of households as employers of domestic personnel,91,26,65,24,6,18,67,20,47,53,8,45,39,7,32,14,1,13
`12,`247,District - East Kameng,`97,`970,`9700,Activities of households as employers of domestic personnel,91,26,65,24,6,18,67,20,47,53,8,45,39,7,32,14,1,13
`12,`247,District - East Kameng,`98,`000,`0000,Undifferentiated goods- and services-producing activities of private,2,1,1,1,0,1,1,1,0,0,0,0,0,0,0,0,0,0
`12,`247,District - East Kameng,`98,`981,`0000,Undifferentiated goods-producing activities of private households for own,2,1,1,1,0,1,1,1,0,0,0,0,0,0,0,0,0,0
`12,`247,District - East Kameng,`98,`981,`9810,Undifferentiated goods-producing activities of private households for own,2,1,1,1,0,1,1,1,0,0,0,0,0,0,0,0,0,0
`12,`247,District - East Kameng,`99,`000,`0000,Activities of extraterritorial organizations and bodies,540,176,364,219,104,115,321,72,249,763,354,409,440,227,213,323,127,196
`12,`247,District - East Kameng,`99,`991,`0000,Blank,302,138,164,134,73,61,168,65,103,520,238,282,229,119,110,291,119,172
`12,`247,District - East Kameng,`99,`991,`9910,Blank,302,138,164,134,73,61,168,65,103,520,238,282,229,119,110,291,119,172
`12,`247,District - East Kameng,`99,`992,`0000,Incomplete description/ Wrongly Classifed,238,38,200,85,31,54,153,7,146,243,116,127,211,108,103,32,8,24
`12,`247,District - East Kameng,`99,`992,`9920,Incomplete description/ Wrongly Classifed,238,38,200,85,31,54,153,7,146,243,116,127,211,108,103,32,8,24
`12,`248,District - Papum Pare,`00,`000,`0000,Total,39904,28577,11327,11958,8904,3054,27946,19673,8273,10594,5211,5383,3412,1684,1728,7182,3527,3655
`12,`248,District - Papum Pare,`01,`000,`0000,"Crop and animal production, hunting and related service activities",881,547,334,426,260,166,455,287,168,295,149,146,172,92,80,123,57,66
`12,`248,District - Papum Pare,`01,`011,`0000,Growing of non-perennial crops,404,242,162,196,114,82,208,128,80,193,93,100,92,46,46,101,47,54
`12,`248,District - Papum Pare,`01,`011,`0112,Growing of rice,357,225,132,186,110,76,171,115,56,167,79,88,74,36,38,93,43,50
`12,`248,District - Papum Pare,`01,`011,`0113,"Growing of vegetables and melons, roots and tubers",47,17,30,10,4,6,37,13,24,26,14,12,18,10,8,8,4,4
`12,`248,District - Papum Pare,`01,`012,`0000,Growing of perennial crops,71,49,22,44,26,18,27,23,4,10,2,8,8,2,6,2,0,2
`12,`248,District - Papum Pare,`01,`012,`0122,Growing of tropical and subtropical fruits,8,8,0,0,0,0,8,8,0,0,0,0,0,0,0,0,0,0
`12,`248,District - Papum Pare,`01,`012,`0123,Growing of citrus fruits,7,5,2,0,0,0,7,5,2,0,0,0,0,0,0,0,0,0
`12,`248,District - Papum Pare,`01,`012,`0124,Growing of pome fruits and stone fruits,4,4,0,0,0,0,4,4,0,0,0,0,0,0,0,0,0,0
`12,`248,District - Papum Pare,`01,`012,`0125,Growing of other tree and bush fruits and nuts,4,4,0,2,2,0,2,2,0,0,0,0,0,0,0,0,0,0
`12,`248,District - Papum Pare,`01,`012,`0126,Growing of oleaginous fruits,14,6,8,12,6,6,2,0,2,0,0,0,0,0,0,0,0,0
`12,`248,District - Papum Pare,`01,`012,`0127,Growing of beverage crops,34,22,12,30,18,12,4,4,0,2,0,2,2,0,2,0,0,0
`12,`248,District - Papum Pare,`01,`012,`0128,"Growing of spices, aromatic, drug and pharmaceutical crops",0,0,0,0,0,0,0,0,0,8,2,6,6,2,4,2,0,2
`12,`248,District - Papum Pare,`01,`013,`0000,Plant propagation,15,9,6,2,0,2,13,9,4,0,0,0,0,0,0,0,0,0
`12,`248,District - Papum Pare,`01,`013,`0130,Plant propagation,15,9,6,2,0,2,13,9,4,0,0,0,0,0,0,0,0,0
`12,`248,District - Papum Pare,`01,`014,`0000,Animal production,86,72,14,62,48,14,24,24,0,7,3,4,4,0,4,3,3,0
`12,`248,District - Papum Pare,`01,`014,`0141,Raising of cattle and buffaloes,22,22,0,6,6,0,16,16,0,5,3,2,2,0,2,3,3,0
`12,`248,District - Papum Pare,`01,`014,`0145,Raising of swine/pigs,6,2,4,6,2,4,0,0,0,0,0,0,0,0,0,0,0,0
`12,`248,District - Papum Pare,`01,`014,`0146,Raising of poultry,37,35,2,34,32,2,3,3,0,0,0,0,0,0,0,0,0,0
`12,`248,District - Papum Pare,`01,`014,`0149,Raising of other animals,21,13,8,16,8,8,5,5,0,2,0,2,2,0,2,0,0,0
`12,`248,District - Papum Pare,`01,`015,`0000,Mixed farming,65,33,32,30,12,18,35,21,14,26,16,10,20,14,6,6,2,4
`12,`248,District - Papum Pare,`01,`015,`0150,Mixed farming,65,33,32,30,12,18,35,21,14,26,16,10,20,14,6,6,2,4
`12,`248,District - Papum Pare,`01,`016,`0000,Support activities to agriculture and post-harvest crop activities,240,142,98,92,60,32,148,82,66,59,35,24,48,30,18,11,5,6
`12,`248,District - Papum Pare,`01,`016,`0161,Support activities for crop production,115,68,47,50,38,12,65,30,35,17,11,6,12,6,6,5,5,0
`12,`248,District - Papum Pare,`01,`016,`0162,Support activities for animal production,10,0,10,10,0,10,0,0,0,0,0,0,0,0,0,0,0,0
`12,`248,District - Papum Pare,`01,`016,`0163,Post-harvest crop activities,107,66,41,24,14,10,83,52,31,42,24,18,36,24,12,6,0,6
`12,`248,District - Papum Pare,`01,`016,`0164,Seed processing for propagation,8,8,0,8,8,0,0,0,0,0,0,0,0,0,0,0,0,0
`12,`248,District - Papum Pare,`02,`000,`0000,Forestry and logging,974,644,330,320,228,92,654,416,238,50,25,25,14,10,4,36,15,21
`12,`248,District - Papum Pare,`02,`021,`0000,Silviculture and other forestry activities,73,47,26,6,4,2,67,43,24,2,2,0,0,0,0,2,2,0
`12,`248,District - Papum Pare,`02,`021,`0210,Silviculture and other forestry activities,73,47,26,6,4,2,67,43,24,2,2,0,0,0,0,2,2,0
`12,`248,District - Papum Pare,`02,`022,`0000,Logging,10,6,4,8,4,4,2,2,0,4,4,0,4,4,0,0,0,0
`12,`248,District - Papum Pare,`02,`022,`0220,Logging,10,6,4,8,4,4,2,2,0,4,4,0,4,4,0,0,0,0
`12,`248,District - Papum Pare,`02,`023,`0000,Gathering of non-wood forest products,6,4,2,2,2,0,4,2,2,0,0,0,0,0,0,0,0,0
`12,`248,District - Papum Pare,`02,`023,`0230,Gathering of non-wood forest products,6,4,2,2,2,0,4,2,2,0,0,0,0,0,0,0,0,0
`12,`248,District - Papum Pare,`02,`024,`0000,Support services to forestry,885,587,298,304,218,86,581,369,212,44,19,25,10,6,4,34,13,21
`12,`248,District - Papum Pare,`02,`024,`0240,Support services to forestry,885,587,298,304,218,86,581,369,212,44,19,25,10,6,4,34,13,21
`12,`248,District - Papum Pare,`03,`000,`0000,Fishing and aquaculture,25,23,2,14,12,2,11,11,0,2,2,0,2,2,0,0,0,0
`12,`248,District - Papum Pare,`03,`031,`0000,Fishing,21,19,2,12,10,2,9,9,0,2,2,0,2,2,0,0,0,0
`12,`248,District - Papum Pare,`03,`031,`0311,Marine fishing,17,15,2,8,6,2,9,9,0,2,2,0,2,2,0,0,0,0
`12,`248,District - Papum Pare,`03,`031,`0312,Freash water fishing,4,4,0,4,4,0,0,0,0,0,0,0,0,0,0,0,0,0
`12,`248,District - Papum Pare,`03,`032,`0000,Aquaculture,4,4,0,2,2,0,2,2,0,0,0,0,0,0,0,0,0,0
`12,`248,District - Papum Pare,`03,`032,`0322,Freshwater aquaculture,4,4,0,2,2,0,2,2,0,0,0,0,0,0,0,0,0,0
`12,`248,District - Papum Pare,`05,`000,`0000,Mining of coal and lignite,2,0,2,0,0,0,2,0,2,0,0,0,0,0,0,0,0,0
`12,`248,District - Papum Pare,`05,`051,`0000,Mining of hard coal,2,0,2,0,0,0,2,0,2,0,0,0,0,0,0,0,0,0
`12,`248,District - Papum Pare,`05,`051,`0510,Mining of hard coal,2,0,2,0,0,0,2,0,2,0,0,0,0,0,0,0,0,0
