State Code,District Code,India/States,Division,Group,Class,NIC Name,Main Workers - Total -  Persons,Main Workers - Total - Males,Main Workers - Total - Females,Main Workers - Rural -  Persons,Main Workers - Rural - Males,Main Workers - Rural - Females,Main Workers - Urban -  Persons,Main Workers - Urban - Males,Main Workers - Urban - Females,Marginal Workers - Total -  Persons,Marginal Workers - Total - Males,Marginal Workers - Total - Females,Marginal Workers - Rural -  Persons,Marginal Workers - Rural - Males,Marginal Workers - Rural - Females,Marginal Workers - Urban -  Persons,Marginal Workers - Urban - Males,Marginal Workers - Urban - Females
`30,`585,District - North Goa,`07,`072,`0729,Mining of other non-ferrous metal ores,15,12,3,6,6,0,9,6,3,6,6,0,6,6,0,0,0,0
`30,`585,District - North Goa,`08,`000,`0000,Other mining and quarrying,50,39,11,30,24,6,20,15,5,30,18,12,24,12,12,6,6,0
`30,`585,District - North Goa,`08,`081,`0000,"Quarrying of stone, sand and clay",3,3,0,0,0,0,3,3,0,30,18,12,24,12,12,6,6,0
`30,`585,District - North Goa,`08,`081,`0810,"Quarrying of stone, sand and clay",3,3,0,0,0,0,3,3,0,30,18,12,24,12,12,6,6,0
`30,`585,District - North Goa,`08,`089,`0000,Mining and quarrying n.e.c.,47,36,11,30,24,6,17,12,5,0,0,0,0,0,0,0,0,0
`30,`585,District - North Goa,`08,`089,`0899,Other mining and quarrying n.e.c.,47,36,11,30,24,6,17,12,5,0,0,0,0,0,0,0,0,0
`30,`585,District - North Goa,`10,`000,`0000,Manufacture of food products,88,71,17,52,38,14,36,33,3,17,12,5,6,6,0,11,6,5
`30,`585,District - North Goa,`10,`103,`0000,Processing and preserving of fruit and vegetables,12,12,0,12,12,0,0,0,0,3,0,3,0,0,0,3,0,3
`30,`585,District - North Goa,`10,`103,`1030,Processing and preserving of fruit and vegetables,12,12,0,12,12,0,0,0,0,3,0,3,0,0,0,3,0,3
`30,`585,District - North Goa,`10,`105,`0000,Manufacture of dairy products,23,21,2,14,12,2,9,9,0,0,0,0,0,0,0,0,0,0
`30,`585,District - North Goa,`10,`105,`1050,Manufacture of dairy products,23,21,2,14,12,2,9,9,0,0,0,0,0,0,0,0,0,0
`30,`585,District - North Goa,`10,`107,`0000,Manufacture of other food products,53,38,15,26,14,12,27,24,3,14,12,2,6,6,0,8,6,2
`30,`585,District - North Goa,`10,`107,`1071,Manufacture of bakery products,9,9,0,0,0,0,9,9,0,3,3,0,0,0,0,3,3,0
`30,`585,District - North Goa,`10,`107,`1072,Manufacture of sugar,8,8,0,8,8,0,0,0,0,0,0,0,0,0,0,0,0,0
`30,`585,District - North Goa,`10,`107,`1073,"Manufacture of cocoa, chocolate and sugar confectionery",33,18,15,18,6,12,15,12,3,6,6,0,6,6,0,0,0,0
`30,`585,District - North Goa,`10,`107,`1079,Manufacture of other food products n.e.c.,3,3,0,0,0,0,3,3,0,5,3,2,0,0,0,5,3,2
`30,`585,District - North Goa,`11,`000,`0000,Manufacture of beverages,9,6,3,0,0,0,9,6,3,9,6,3,0,0,0,9,6,3
`30,`585,District - North Goa,`11,`110,`0000,Manufacture of beverages,9,6,3,0,0,0,9,6,3,9,6,3,0,0,0,9,6,3
`30,`585,District - North Goa,`11,`110,`1104,Manufacture of soft drinks; production of mineral waters and other,9,6,3,0,0,0,9,6,3,9,6,3,0,0,0,9,6,3
`30,`585,District - North Goa,`13,`000,`0000,Manufacture of textiles,15,12,3,6,6,0,9,6,3,0,0,0,0,0,0,0,0,0
`30,`585,District - North Goa,`13,`131,`0000,"Spinning, weaving and finishing of textiles",15,12,3,6,6,0,9,6,3,0,0,0,0,0,0,0,0,0
`30,`585,District - North Goa,`13,`131,`1311,Preparation and spinning of textile fibres,12,9,3,6,6,0,6,3,3,0,0,0,0,0,0,0,0,0
`30,`585,District - North Goa,`13,`131,`1313,Finishing of textiles,3,3,0,0,0,0,3,3,0,0,0,0,0,0,0,0,0,0
`30,`585,District - North Goa,`14,`000,`0000,Manufacture of wearing apparel,34,9,25,20,6,14,14,3,11,3,0,3,0,0,0,3,0,3
`30,`585,District - North Goa,`14,`141,`0000,"Manufacture of wearing apparel, except fur apparel",34,9,25,20,6,14,14,3,11,3,0,3,0,0,0,3,0,3
`30,`585,District - North Goa,`14,`141,`1410,"Manufacture of wearing apparel, except fur apparel",34,9,25,20,6,14,14,3,11,3,0,3,0,0,0,3,0,3
`30,`585,District - North Goa,`15,`000,`0000,Manufacture of leather and related products,52,43,9,12,6,6,40,37,3,3,3,0,0,0,0,3,3,0
`30,`585,District - North Goa,`15,`152,`0000,Manufacture of footwear,52,43,9,12,6,6,40,37,3,3,3,0,0,0,0,3,3,0
`30,`585,District - North Goa,`15,`152,`1520,Manufacture of footwear,52,43,9,12,6,6,40,37,3,3,3,0,0,0,0,3,3,0
`30,`585,District - North Goa,`16,`000,`0000,"Manufacture of wood and products of wood and cork, except furniture;",107,41,66,68,24,44,39,17,22,158,53,105,136,38,98,22,15,7
`30,`585,District - North Goa,`16,`161,`0000,Sawmilling and planing of wood,6,6,0,0,0,0,6,6,0,0,0,0,0,0,0,0,0,0
`30,`585,District - North Goa,`16,`161,`1610,Saw milling and planing of wood,6,6,0,0,0,0,6,6,0,0,0,0,0,0,0,0,0,0
`30,`585,District - North Goa,`16,`162,`0000,"Manufacture of products of wood, cork, straw and plaiting materials",101,35,66,68,24,44,33,11,22,158,53,105,136,38,98,22,15,7
`30,`585,District - North Goa,`16,`162,`1623,Manufacture of wooden containers,70,28,42,42,20,22,28,8,20,88,27,61,74,18,56,14,9,5
`30,`585,District - North Goa,`16,`162,`1629,"Manufacture of other products of wood; manufacture of articles of cork,",31,7,24,26,4,22,5,3,2,70,26,44,62,20,42,8,6,2
`30,`585,District - North Goa,`17,`000,`0000,Manufacture of paper and paper products,3,3,0,0,0,0,3,3,0,0,0,0,0,0,0,0,0,0
`30,`585,District - North Goa,`17,`170,`0000,Manufacture of paper and paper products,3,3,0,0,0,0,3,3,0,0,0,0,0,0,0,0,0,0
`30,`585,District - North Goa,`17,`170,`1709,Manufacture of other articles of paper and paperboard,3,3,0,0,0,0,3,3,0,0,0,0,0,0,0,0,0,0
`30,`585,District - North Goa,`18,`000,`0000,Printing and reproduction of recorded media,11,6,5,2,0,2,9,6,3,0,0,0,0,0,0,0,0,0
`30,`585,District - North Goa,`18,`181,`0000,Printing and service activities related to printing,11,6,5,2,0,2,9,6,3,0,0,0,0,0,0,0,0,0
`30,`585,District - North Goa,`18,`181,`1811,Printing,8,3,5,2,0,2,6,3,3,0,0,0,0,0,0,0,0,0
`30,`585,District - North Goa,`18,`181,`1812,Service activities related to printing,3,3,0,0,0,0,3,3,0,0,0,0,0,0,0,0,0,0
`30,`585,District - North Goa,`20,`000,`0000,Manufacture of chemicals and chemical products,23,15,8,20,12,8,3,3,0,2,2,0,2,2,0,0,0,0
`30,`585,District - North Goa,`20,`201,`0000,"Manufacture of basic chemicals, fertilizer and nitrogen compounds, plastics",9,9,0,6,6,0,3,3,0,0,0,0,0,0,0,0,0,0
`30,`585,District - North Goa,`20,`201,`2011,Manufacture of basic chemicals,9,9,0,6,6,0,3,3,0,0,0,0,0,0,0,0,0,0
`30,`585,District - North Goa,`20,`202,`0000,Manufacture of other chemical products,14,6,8,14,6,8,0,0,0,2,2,0,2,2,0,0,0,0
`30,`585,District - North Goa,`20,`202,`2023,"Manufacture of soap and detergents, cleaning and polishing preparations,",14,6,8,14,6,8,0,0,0,2,2,0,2,2,0,0,0,0
`30,`585,District - North Goa,`21,`000,`0000,"Manufacture of pharmaceuticals, medicinal chemical and botanical products",45,18,27,36,18,18,9,0,9,3,3,0,0,0,0,3,3,0
`30,`585,District - North Goa,`21,`210,`0000,"Manufacture of pharmaceuticals, medicinal chemical and botanical products",45,18,27,36,18,18,9,0,9,3,3,0,0,0,0,3,3,0
`30,`585,District - North Goa,`21,`210,`2100,"Manufacture of pharmaceuticals, medicinal chemical and botanical",45,18,27,36,18,18,9,0,9,3,3,0,0,0,0,3,3,0
`30,`585,District - North Goa,`22,`000,`0000,Manufacture of rubber and plastics products,18,18,0,6,6,0,12,12,0,0,0,0,0,0,0,0,0,0
`30,`585,District - North Goa,`22,`221,`0000,Manufacture of rubber products,18,18,0,6,6,0,12,12,0,0,0,0,0,0,0,0,0,0
`30,`585,District - North Goa,`22,`221,`2211,Manufacture of rubber tyres and tubes; retreading and rebuilding of,15,15,0,6,6,0,9,9,0,0,0,0,0,0,0,0,0,0
`30,`585,District - North Goa,`22,`221,`2219,Manufacture of other rubber products,3,3,0,0,0,0,3,3,0,0,0,0,0,0,0,0,0,0
`30,`585,District - North Goa,`23,`000,`0000,Manufacture of other non-metallic mineral products,30,21,9,6,0,6,24,21,3,3,0,3,0,0,0,3,0,3
`30,`585,District - North Goa,`23,`239,`0000,Manufacture of non-metallic mineral products n.e.c.,30,21,9,6,0,6,24,21,3,3,0,3,0,0,0,3,0,3
`30,`585,District - North Goa,`23,`239,`2391,Manufacture of refractory products,3,3,0,0,0,0,3,3,0,0,0,0,0,0,0,0,0,0
`30,`585,District - North Goa,`23,`239,`2393,Manufacture of other porcelain and ceramic products,3,3,0,0,0,0,3,3,0,0,0,0,0,0,0,0,0,0
`30,`585,District - North Goa,`23,`239,`2394,"Manufacture of cement, lime and plaster",21,12,9,6,0,6,15,12,3,3,0,3,0,0,0,3,0,3
`30,`585,District - North Goa,`23,`239,`2396,"Cutting, shaping and finishing of stone",3,3,0,0,0,0,3,3,0,0,0,0,0,0,0,0,0,0
`30,`585,District - North Goa,`24,`000,`0000,Manufacture of basic metals,3,3,0,0,0,0,3,3,0,6,0,6,6,0,6,0,0,0
`30,`585,District - North Goa,`24,`241,`0000,Manufacture of basic iron and steel,3,3,0,0,0,0,3,3,0,6,0,6,6,0,6,0,0,0
`30,`585,District - North Goa,`24,`241,`2410,Manufacture of basic iron and steel,3,3,0,0,0,0,3,3,0,6,0,6,6,0,6,0,0,0
`30,`585,District - North Goa,`25,`000,`0000,"Manufacture of fabricated metal products, except machinery and equipment",40,32,8,28,20,8,12,12,0,15,15,0,6,6,0,9,9,0
`30,`585,District - North Goa,`25,`251,`0000,"Manufacture of structural metal products, tanks, reservoirs and steam",6,6,0,6,6,0,0,0,0,0,0,0,0,0,0,0,0,0
`30,`585,District - North Goa,`25,`251,`2511,Manufacture of structural metal products,6,6,0,6,6,0,0,0,0,0,0,0,0,0,0,0,0,0
`30,`585,District - North Goa,`25,`259,`0000,Manufacture of other fabricated metal products; metalworking service,34,26,8,22,14,8,12,12,0,15,15,0,6,6,0,9,9,0
`30,`585,District - North Goa,`25,`259,`2593,"Manufacture of cutlery, hand tools and general hardware",20,12,8,14,6,8,6,6,0,3,3,0,0,0,0,3,3,0
`30,`585,District - North Goa,`25,`259,`2599,Manufacture of other fabricated metal products n.e.c.,14,14,0,8,8,0,6,6,0,12,12,0,6,6,0,6,6,0
`30,`585,District - North Goa,`26,`000,`0000,"Manufacture of computer, electronic and optical products",8,8,0,2,2,0,6,6,0,2,2,0,0,0,0,2,2,0
`30,`585,District - North Goa,`26,`261,`0000,Manufacture of electronic components,2,2,0,2,2,0,0,0,0,0,0,0,0,0,0,0,0,0
`30,`585,District - North Goa,`26,`261,`2610,Manufacture of electronic components,2,2,0,2,2,0,0,0,0,0,0,0,0,0,0,0,0,0
`30,`585,District - North Goa,`26,`262,`0000,Manufacture of computers and peripheral equipment,0,0,0,0,0,0,0,0,0,2,2,0,0,0,0,2,2,0
`30,`585,District - North Goa,`26,`262,`2620,Manufacture of computers and peripheral equipment,0,0,0,0,0,0,0,0,0,2,2,0,0,0,0,2,2,0
`30,`585,District - North Goa,`26,`263,`0000,Manufacture of communication equipment,6,6,0,0,0,0,6,6,0,0,0,0,0,0,0,0,0,0
`30,`585,District - North Goa,`26,`263,`2630,Manufacture of communication equipment,6,6,0,0,0,0,6,6,0,0,0,0,0,0,0,0,0,0
`30,`585,District - North Goa,`27,`000,`0000,Manufacture of electrical equipment,6,6,0,0,0,0,6,6,0,2,2,0,0,0,0,2,2,0
`30,`585,District - North Goa,`27,`275,`0000,Manufacture of domestic appliances,6,6,0,0,0,0,6,6,0,2,2,0,0,0,0,2,2,0
`30,`585,District - North Goa,`27,`275,`2750,Manufacture of domestic appliances,6,6,0,0,0,0,6,6,0,2,2,0,0,0,0,2,2,0
`30,`585,District - North Goa,`29,`000,`0000,"Manufacture of motor vehicles, trailers and semi-trailers",38,30,8,20,12,8,18,18,0,0,0,0,0,0,0,0,0,0
`30,`585,District - North Goa,`29,`291,`0000,Manufacture of motor vehicles,6,0,6,6,0,6,0,0,0,0,0,0,0,0,0,0,0,0
`30,`585,District - North Goa,`29,`291,`2910,Manufacture of motor vehicles,6,0,6,6,0,6,0,0,0,0,0,0,0,0,0,0,0,0
`30,`585,District - North Goa,`29,`292,`0000,Manufacture of bodies (coachwork) for motor vehicles; manufacture of,26,24,2,8,6,2,18,18,0,0,0,0,0,0,0,0,0,0
`30,`585,District - North Goa,`29,`292,`2920,Manufacture of bodies (coachwork) for motor vehicles; manufacture of trailers and semi-trailers,26,24,2,8,6,2,18,18,0,0,0,0,0,0,0,0,0,0
`30,`585,District - North Goa,`29,`293,`0000,Manufacture of parts and accessories for motor vehicles,6,6,0,6,6,0,0,0,0,0,0,0,0,0,0,0,0,0
`30,`585,District - North Goa,`29,`293,`2930,Manufacture of parts and accessories for motor vehicles,6,6,0,6,6,0,0,0,0,0,0,0,0,0,0,0,0,0
`30,`585,District - North Goa,`30,`000,`0000,Manufacture of other transport equipment,9,9,0,0,0,0,9,9,0,3,3,0,0,0,0,3,3,0
`30,`585,District - North Goa,`30,`301,`0000,Building of ships and boats,3,3,0,0,0,0,3,3,0,3,3,0,0,0,0,3,3,0
`30,`585,District - North Goa,`30,`301,`3011,Building of ships and floating structures,3,3,0,0,0,0,3,3,0,3,3,0,0,0,0,3,3,0
`30,`585,District - North Goa,`30,`309,`0000,Manufacture of transport equipment n.e.c.,6,6,0,0,0,0,6,6,0,0,0,0,0,0,0,0,0,0
`30,`585,District - North Goa,`30,`309,`3091,Manufacture of motorcycles,3,3,0,0,0,0,3,3,0,0,0,0,0,0,0,0,0,0
`30,`585,District - North Goa,`30,`309,`3099,Manufacture of other transport equipment n.e.c.,3,3,0,0,0,0,3,3,0,0,0,0,0,0,0,0,0,0
`30,`585,District - North Goa,`31,`000,`0000,Manufacture of furniture,10,8,2,8,6,2,2,2,0,5,5,0,0,0,0,5,5,0
`30,`585,District - North Goa,`31,`310,`0000,Manufacture of furniture,10,8,2,8,6,2,2,2,0,5,5,0,0,0,0,5,5,0
`30,`585,District - North Goa,`31,`310,`3100,Manufacture of furniture,10,8,2,8,6,2,2,2,0,5,5,0,0,0,0,5,5,0
`30,`585,District - North Goa,`32,`000,`0000,Other manufacturing,183,147,36,108,86,22,75,61,14,69,45,24,34,24,10,35,21,14
`30,`585,District - North Goa,`32,`322,`0000,Manufacture of musical instruments,3,3,0,0,0,0,3,3,0,0,0,0,0,0,0,0,0,0
`30,`585,District - North Goa,`32,`322,`3220,Manufacture of musical instruments,3,3,0,0,0,0,3,3,0,0,0,0,0,0,0,0,0,0
`30,`585,District - North Goa,`32,`329,`0000,Other manufacturing n.e.c.,180,144,36,108,86,22,72,58,14,69,45,24,34,24,10,35,21,14
`30,`585,District - North Goa,`32,`329,`3290,Other manufacturing n.e.c.,180,144,36,108,86,22,72,58,14,69,45,24,34,24,10,35,21,14
`30,`585,District - North Goa,`33,`000,`0000,Repair and installation of machinery and equipment,26,26,0,20,20,0,6,6,0,0,0,0,0,0,0,0,0,0
`30,`585,District - North Goa,`33,`331,`0000,"Repair of fabricated metal products, machinery and equipment",26,26,0,20,20,0,6,6,0,0,0,0,0,0,0,0,0,0
`30,`585,District - North Goa,`33,`331,`3311,Repair of fabricated metal products,3,3,0,0,0,0,3,3,0,0,0,0,0,0,0,0,0,0
`30,`585,District - North Goa,`33,`331,`3314,Repair of electrical equipment,17,17,0,14,14,0,3,3,0,0,0,0,0,0,0,0,0,0
`30,`585,District - North Goa,`33,`331,`3315,"Repair of transport equipment, except motor vehicles",6,6,0,6,6,0,0,0,0,0,0,0,0,0,0,0,0,0
`30,`585,District - North Goa,`35,`000,`0000,"Electricity, gas, steam and air conditioning supply",87,75,12,60,54,6,27,21,6,0,0,0,0,0,0,0,0,0
`30,`585,District - North Goa,`35,`351,`0000,"Electric power generation, transmission and distribution",87,75,12,60,54,6,27,21,6,0,0,0,0,0,0,0,0,0
`30,`585,District - North Goa,`35,`351,`3510,"Electric power generation, transmission and distribution",87,75,12,60,54,6,27,21,6,0,0,0,0,0,0,0,0,0
`30,`585,District - North Goa,`41,`000,`0000,Construction of buildings,216,181,35,68,62,6,148,119,29,141,101,40,86,52,34,55,49,6
`30,`585,District - North Goa,`41,`410,`0000,Construction of buildings,216,181,35,68,62,6,148,119,29,141,101,40,86,52,34,55,49,6
`30,`585,District - North Goa,`41,`410,`4100,Construction of buildings,216,181,35,68,62,6,148,119,29,141,101,40,86,52,34,55,49,6
`30,`585,District - North Goa,`42,`000,`0000,Civil engineering,27,27,0,18,18,0,9,9,0,58,24,34,58,24,34,0,0,0
`30,`585,District - North Goa,`42,`421,`0000,Construction of roads and railways,6,6,0,6,6,0,0,0,0,52,18,34,52,18,34,0,0,0
`30,`585,District - North Goa,`42,`421,`4210,Construction roads and railways,6,6,0,6,6,0,0,0,0,52,18,34,52,18,34,0,0,0
`30,`585,District - North Goa,`42,`422,`0000,Construction of utility projects,6,6,0,0,0,0,6,6,0,6,6,0,6,6,0,0,0,0
`30,`585,District - North Goa,`42,`422,`4220,Construction of utility projects,6,6,0,0,0,0,6,6,0,6,6,0,6,6,0,0,0,0
`30,`585,District - North Goa,`42,`429,`0000,Construction of other civil engineering projects,15,15,0,12,12,0,3,3,0,0,0,0,0,0,0,0,0,0
`30,`585,District - North Goa,`42,`429,`4290,Construction of other civil engineering projects,15,15,0,12,12,0,3,3,0,0,0,0,0,0,0,0,0,0
`30,`585,District - North Goa,`43,`000,`0000,Specialized construction activities,265,237,28,86,78,8,179,159,20,81,72,9,50,44,6,31,28,3
`30,`585,District - North Goa,`43,`431,`0000,Demolition and site preparation,81,58,23,40,34,6,41,24,17,23,17,6,20,14,6,3,3,0
`30,`585,District - North Goa,`43,`431,`4312,Site preparation,81,58,23,40,34,6,41,24,17,23,17,6,20,14,6,3,3,0
`30,`585,District - North Goa,`43,`432,`0000,"Electrical, plumbing and other construction installation activities",12,12,0,6,6,0,6,6,0,0,0,0,0,0,0,0,0,0
`30,`585,District - North Goa,`43,`432,`4322,"Plumbing, heat and air-conditioning installation",12,12,0,6,6,0,6,6,0,0,0,0,0,0,0,0,0,0
`30,`585,District - North Goa,`43,`433,`0000,Building completion and finishing,169,164,5,40,38,2,129,126,3,58,55,3,30,30,0,28,25,3
`30,`585,District - North Goa,`43,`433,`4330,Building completion and finishing,169,164,5,40,38,2,129,126,3,58,55,3,30,30,0,28,25,3
`30,`585,District - North Goa,`43,`439,`0000,Other specialized construction activities,3,3,0,0,0,0,3,3,0,0,0,0,0,0,0,0,0,0
`30,`585,District - North Goa,`43,`439,`4390,Other specialized construction activities,3,3,0,0,0,0,3,3,0,0,0,0,0,0,0,0,0,0
`30,`585,District - North Goa,`45,`000,`0000,Wholesale and retail trade and repair of motor vehicles and motorcycles,49,43,6,14,14,0,35,29,6,20,20,0,12,12,0,8,8,0
`30,`585,District - North Goa,`45,`451,`0000,Sale of motor vehicles,5,2,3,0,0,0,5,2,3,0,0,0,0,0,0,0,0,0
`30,`585,District - North Goa,`45,`451,`4510,Sale of motor vehicles,5,2,3,0,0,0,5,2,3,0,0,0,0,0,0,0,0,0
`30,`585,District - North Goa,`45,`452,`0000,Maintenance and repair of motor vehicles,33,33,0,12,12,0,21,21,0,11,11,0,6,6,0,5,5,0
`30,`585,District - North Goa,`45,`452,`4520,Maintenance and repair of motor vehicles,33,33,0,12,12,0,21,21,0,11,11,0,6,6,0,5,5,0
`30,`585,District - North Goa,`45,`454,`0000,"Sale, maintenance and repair of motorcycles and related parts and",11,8,3,2,2,0,9,6,3,9,9,0,6,6,0,3,3,0
`30,`585,District - North Goa,`45,`454,`4540,"Sale, maintenance and repair of motorcycles and related parts and",11,8,3,2,2,0,9,6,3,9,9,0,6,6,0,3,3,0
`30,`585,District - North Goa,`46,`000,`0000,"Wholesale trade, except of motor vehicles and motorcycles",47,39,8,18,12,6,29,27,2,5,0,5,0,0,0,5,0,5
`30,`585,District - North Goa,`46,`462,`0000,Wholesale of agricultural raw materials and live animals,3,3,0,0,0,0,3,3,0,0,0,0,0,0,0,0,0,0
`30,`585,District - North Goa,`46,`462,`4620,Wholesale of agricultural raw materials and live animals,3,3,0,0,0,0,3,3,0,0,0,0,0,0,0,0,0,0
`30,`585,District - North Goa,`46,`463,`0000,"Wholesale of food, beverages and tobacco",15,15,0,0,0,0,15,15,0,0,0,0,0,0,0,0,0,0
`30,`585,District - North Goa,`46,`463,`4630,"Wholesale of food, beverages and tobacco",15,15,0,0,0,0,15,15,0,0,0,0,0,0,0,0,0,0
`30,`585,District - North Goa,`46,`464,`0000,Wholesale of household goods,3,3,0,0,0,0,3,3,0,0,0,0,0,0,0,0,0,0
`30,`585,District - North Goa,`46,`464,`4641,"Wholesale of textiles, clothing and footwear",3,3,0,0,0,0,3,3,0,0,0,0,0,0,0,0,0,0
`30,`585,District - North Goa,`46,`466,`0000,Other specialized wholesale,17,15,2,12,12,0,5,3,2,2,0,2,0,0,0,2,0,2
`30,`585,District - North Goa,`46,`466,`4662,Wholesale of metals and metal ores,6,6,0,6,6,0,0,0,0,0,0,0,0,0,0,0,0,0
`30,`585,District - North Goa,`46,`466,`4663,"Wholesale of construction materials, hardware, plumbing and heating",3,3,0,0,0,0,3,3,0,0,0,0,0,0,0,0,0,0
`30,`585,District - North Goa,`46,`466,`4669,Wholesale of waste and scrap and other products n.e.c.,8,6,2,6,6,0,2,0,2,2,0,2,0,0,0,2,0,2
`30,`585,District - North Goa,`46,`469,`0000,Non-specialized wholesale trade,9,3,6,6,0,6,3,3,0,3,0,3,0,0,0,3,0,3
`30,`585,District - North Goa,`46,`469,`4690,Non-specialized wholesale trade,9,3,6,6,0,6,3,3,0,3,0,3,0,0,0,3,0,3
`30,`585,District - North Goa,`47,`000,`0000,"Retail trade, except of motor vehicles and motorcycles",460,341,119,158,98,60,302,243,59,71,55,16,32,28,4,39,27,12
`30,`585,District - North Goa,`47,`471,`0000,Retail sale in non-specialized stores,31,14,17,16,2,14,15,12,3,3,3,0,0,0,0,3,3,0
`30,`585,District - North Goa,`47,`471,`4719,Other retail sale in non-specialized stores,31,14,17,16,2,14,15,12,3,3,3,0,0,0,0,3,3,0
`30,`585,District - North Goa,`47,`472,`0000,"Retail sale of food, beverages and tobacco in specialized stores",112,79,33,24,16,8,88,63,25,22,17,5,16,14,2,6,3,3
`30,`585,District - North Goa,`47,`472,`4721,Retail sale of food in specialized stores,92,65,27,22,14,8,70,51,19,22,17,5,16,14,2,6,3,3
`30,`585,District - North Goa,`47,`472,`4722,Retail sale of beverages in specialized stores,17,11,6,2,2,0,15,9,6,0,0,0,0,0,0,0,0,0
`30,`585,District - North Goa,`47,`472,`4723,Retail sale of tobacco products in specialized stores,3,3,0,0,0,0,3,3,0,0,0,0,0,0,0,0,0,0
`30,`585,District - North Goa,`47,`473,`0000,Retail sale of automotive fuel in specialized stores,8,8,0,2,2,0,6,6,0,2,0,2,2,0,2,0,0,0
`30,`585,District - North Goa,`47,`473,`4730,Retail sale of automotive fuel in specialized stores,8,8,0,2,2,0,6,6,0,2,0,2,2,0,2,0,0,0
`30,`585,District - North Goa,`47,`474,`0000,Retail sale of information and communications equipment in specialized,12,12,0,6,6,0,6,6,0,0,0,0,0,0,0,0,0,0
`30,`585,District - North Goa,`47,`474,`4741,"Retail sale of computers, peripheral units, software and",12,12,0,6,6,0,6,6,0,0,0,0,0,0,0,0,0,0
`30,`585,District - North Goa,`47,`475,`0000,Retail sale of other household equipment in specialized stores,45,31,14,6,0,6,39,31,8,12,12,0,6,6,0,6,6,0
`30,`585,District - North Goa,`47,`475,`4751,Retail sale of textiles in specialized stores,6,6,0,0,0,0,6,6,0,6,6,0,0,0,0,6,6,0
`30,`585,District - North Goa,`47,`475,`4752,"Retail sale of hardware, paints and glass in specialized stores",12,12,0,0,0,0,12,12,0,0,0,0,0,0,0,0,0,0
`30,`585,District - North Goa,`47,`475,`4753,"Retail sale of carpets, rugs, wall and floor coverings in specialized",6,0,6,6,0,6,0,0,0,6,6,0,6,6,0,0,0,0
`30,`585,District - North Goa,`47,`475,`4759,"Retail sale of electrical household appliances, furniture, lighting",21,13,8,0,0,0,21,13,8,0,0,0,0,0,0,0,0,0
`30,`585,District - North Goa,`47,`476,`0000,Retail sale of cultural and recreation goods in specialized stores,18,9,9,12,6,6,6,3,3,0,0,0,0,0,0,0,0,0
`30,`585,District - North Goa,`47,`476,`4761,"Retail sale of books, newspapers and stationary in specialized stores",12,9,3,6,6,0,6,3,3,0,0,0,0,0,0,0,0,0
`30,`585,District - North Goa,`47,`476,`4764,Retail sale of games and toys in specialized stores,6,0,6,6,0,6,0,0,0,0,0,0,0,0,0,0,0,0
`30,`585,District - North Goa,`47,`477,`0000,Retail sale of other goods in specialized stores,147,119,28,68,54,14,79,65,14,26,23,3,8,8,0,18,15,3
`30,`585,District - North Goa,`47,`477,`4771,"Retail sale of clothing, footwear and leather articles in specialized",51,48,3,18,18,0,33,30,3,14,14,0,2,2,0,12,12,0
`30,`585,District - North Goa,`47,`477,`4772,"Retail sale of pharmaceutical and medical goods, cosmetic and toilet",20,15,5,8,6,2,12,9,3,3,3,0,0,0,0,3,3,0
`30,`585,District - North Goa,`47,`477,`4773,Other retail sale of new goods in specialized stores,76,56,20,42,30,12,34,26,8,9,6,3,6,6,0,3,0,3
`30,`585,District - North Goa,`47,`478,`0000,Retail sale via stalls and markets,66,48,18,24,12,12,42,36,6,6,0,6,0,0,0,6,0,6
`30,`585,District - North Goa,`47,`478,`4782,"Retail sale via stalls and markets of textiles, clothing and footwear",6,6,0,6,6,0,0,0,0,0,0,0,0,0,0,0,0,0
`30,`585,District - North Goa,`47,`478,`4789,Retail sale via stalls and markets of other goods,60,42,18,18,6,12,42,36,6,6,0,6,0,0,0,6,0,6
`30,`585,District - North Goa,`47,`479,`0000,"Retail trade not in stores, stalls or markets",21,21,0,0,0,0,21,21,0,0,0,0,0,0,0,0,0,0
`30,`585,District - North Goa,`47,`479,`4799,"Other retail sale not in stores, stalls or markets",21,21,0,0,0,0,21,21,0,0,0,0,0,0,0,0,0,0
`30,`585,District - North Goa,`49,`000,`0000,Land transport and transport via pipelines,398,391,7,182,182,0,216,209,7,46,46,0,20,20,0,26,26,0
`30,`585,District - North Goa,`49,`491,`0000,Transport via railways,12,12,0,12,12,0,0,0,0,0,0,0,0,0,0,0,0,0
`30,`585,District - North Goa,`49,`491,`4911,Passenger rail transport,6,6,0,6,6,0,0,0,0,0,0,0,0,0,0,0,0,0
`30,`585,District - North Goa,`49,`491,`4912,Freight rail transport,6,6,0,6,6,0,0,0,0,0,0,0,0,0,0,0,0,0
`30,`585,District - North Goa,`49,`492,`0000,Other land transport,386,379,7,170,170,0,216,209,7,46,46,0,20,20,0,26,26,0
`30,`585,District - North Goa,`49,`492,`4921,Urban or suburban passenger land transport,28,26,2,12,12,0,16,14,2,0,0,0,0,0,0,0,0,0
`30,`585,District - North Goa,`49,`492,`4922,Other passenger land transport,306,306,0,128,128,0,178,178,0,31,31,0,14,14,0,17,17,0
`30,`585,District - North Goa,`49,`492,`4923,Freight transport by road,52,47,5,30,30,0,22,17,5,15,15,0,6,6,0,9,9,0
`30,`585,District - North Goa,`50,`000,`0000,Water transport,3,3,0,0,0,0,3,3,0,12,12,0,12,12,0,0,0,0
`30,`585,District - North Goa,`50,`501,`0000,Sea and coastal water transport,3,3,0,0,0,0,3,3,0,12,12,0,12,12,0,0,0,0
`30,`585,District - North Goa,`50,`501,`5011,Sea and coastal passenger water transport,0,0,0,0,0,0,0,0,0,12,12,0,12,12,0,0,0,0
`30,`585,District - North Goa,`50,`501,`5012,Sea and coastal freight water transport,3,3,0,0,0,0,3,3,0,0,0,0,0,0,0,0,0,0
`30,`585,District - North Goa,`51,`000,`0000,Air transport,8,8,0,2,2,0,6,6,0,0,0,0,0,0,0,0,0,0
`30,`585,District - North Goa,`51,`511,`0000,Passenger air transport,2,2,0,2,2,0,0,0,0,0,0,0,0,0,0,0,0,0
`30,`585,District - North Goa,`51,`511,`5110,Passenger air transport,2,2,0,2,2,0,0,0,0,0,0,0,0,0,0,0,0,0
`30,`585,District - North Goa,`51,`512,`0000,Freight air transport,6,6,0,0,0,0,6,6,0,0,0,0,0,0,0,0,0,0
`30,`585,District - North Goa,`51,`512,`5120,Freight air transport,6,6,0,0,0,0,6,6,0,0,0,0,0,0,0,0,0,0
`30,`585,District - North Goa,`52,`000,`0000,Warehousing and support activities for transportation,30,24,6,12,12,0,18,12,6,21,21,0,6,6,0,15,15,0
`30,`585,District - North Goa,`52,`521,`0000,Warehousing and storage,18,12,6,6,6,0,12,6,6,13,13,0,0,0,0,13,13,0
`30,`585,District - North Goa,`52,`521,`5210,Warehousing and storage,18,12,6,6,6,0,12,6,6,13,13,0,0,0,0,13,13,0
`30,`585,District - North Goa,`52,`522,`0000,Support activities for transportation,12,12,0,6,6,0,6,6,0,8,8,0,6,6,0,2,2,0
